Stock,Title,Source,Published At,Description
N/A,Eli Lilly vs. Novo Nordisk: What's the Better Weight-Loss Stock to Buy?,Motley Fool,2023-07-27T12:15:00Z,These two drug companies have seen red-hot demand for their weight-loss treatments.
N/A,"Eli Lilly Could Be Making The Next Ozempic, but Should You Buy the Stock?",Motley Fool,2023-07-02T12:15:00Z,Clinical data suggests that a powerful candidate is advancing through its pipeline.
N/A,Is It Too Late to Buy Eli Lilly Stock?,Motley Fool,2023-07-18T09:26:00Z,Shares of the pharmaceutical giant are already up 36% this year.
N/A,2 Unstoppable Growth Stocks That Could Make You Richer in The Next Decade,Motley Fool,2023-07-22T12:00:00Z,Both companies should be a boon to long-term shareholders.
N/A,3 Stocks You'll Be Glad You Bought at These Prices,Motley Fool,2023-07-28T09:10:00Z,Not every ticker has raced to outrageous valuations over the course of the past few months.
N/A,AI Stocks Lead These 5 Names Near Buy Points,Investor's Business Daily,2023-07-22T13:17:24Z,"Marvell Technology is one of three AI stocks near buy points, with two other quality names trading around entries."
N/A,"If You Invested $100 In This Stock 5 Years Ago, You Would Have $300 Today",Biztoc.com,2023-07-14T21:04:05Z,"Novo Nordisk NVO has outperformed the market over the past 5 years by 16.26% on an annualized basis producing an average annual return of 26.15%. Currently, Novo Nordisk has a market capitalization of $358.82 billion. Buying $100 In NVO: If an investor had bo…"
N/A,The EV Truck War Is Officially On,Libsyn.com,2023-07-17T20:00:00Z,Telsa finally introduces the Cybertruck and Ford fights back with a price cut on the F-150Lightning. (00:21) Bill Barker and Deidre Woollard discuss: - The futuristic appeal of the Cybertruck compared to more traditional models. - Why Ford announced a price d…
N/A,What Makes Chipotle Mexican Grill (CMG) a Good Investment?,Yahoo Entertainment,2023-07-13T11:21:34Z,"Rowan Street Capital, an investment management company, released its first half 2023 investor letter. A copy of the same can be downloaded here. The fund..."
N/A,Do You Think Tractor Supply Company (TSCO) is a Great Business to Hold?,Yahoo Entertainment,2023-07-13T11:27:19Z,"Rowan Street Capital, an investment management company, released its first half 2023 investor letter. A copy of the same can be downloaded here. The fund..."
N/A,"Anglerfish, Gila Monsters, and the Origin of Weight Loss Drugs",Libsyn.com,2023-07-30T15:00:00Z,Weight loss drug sales are estimated to hit $44 billion by 2030. Many of these treatments can thank previously obscure research on a carnivorous deep sea fish for their development. Rolfe Winkler is a reporter for the Wall Street Journal covering digital heal…
N/A,What's Going On With Novo Nordisk (NVO) Stock Today,Biztoc.com,2023-07-26T15:40:08Z,"The Medicines and Healthcare Products Regulatory Agency (MHRA), the U.K.'s drug regulatory authority, is reportedly scrutinizing a category of drugs used in diabetes medication and a weight loss product sold by Novo Nordisk A/S NVO. Ozempic and Wegovy have re…"
N/A,"Famed Weight Loss Drug Wegovy by Novo Nordisk Sees Significant Drop In Long-Term Use, Study Reveals",Biztoc.com,2023-07-12T12:38:07Z,"Around 32% of patients prescribed Novo Nordisk A/S's NVO weight-loss drug, Wegovy, were still using the medication a year after their initial prescription, indicating a significant drop in adherence compared to what was reported in clinical trials. The averag…"
N/A,Ukraine’s Surprising Admission,Globalresearch.ca,2023-07-23T13:08:36Z,"All Global Research articles can be read in 51 languages by activating the Translate Website button below the author’s name. To receive Global Research’s Daily Newsletter (selected articles), click here. Click the share button above to email/forward this arti…"
N/A,Marvell Leads 3 AI Stocks Near Buy Points,Biztoc.com,2023-07-22T15:02:05Z,"Artificial intelligence stocks including chipmaker Marvell Technology (MRVL), Arista Networks (ANET) and Synopsys (SNPS), which has launched AI-based chip-design tools, lead this weekend's watch list of five stocks near buy points. In addition to MRVL, ANET a…"
N/A,Marvell Leads 3 AI Stocks Near Buy Points,Biztoc.com,2023-07-22T14:38:05Z,"Artificial intelligence stocks including chipmaker Marvell Technology (MRVL), Arista Networks (ANET) and Synopsys (SNPS), which has launched AI-based chip-design tools, lead this weekend's watch list of five stocks near buy points. In addition to MRVL, ANET a…"
N/A,"The Damaging Report That Sent Weight-Loss Kingpins Novo Nordisk, Eli Lilly Into A Tailspin",Investor's Business Daily,2023-07-11T16:22:21Z,Most patients aren't taking Wegovy or other weight loss drugs for long periods of time.
N/A,Bullish developments for three stocks across sectors,Biztoc.com,2023-07-21T19:14:04Z,"Morgan Stanley analysts believe the market for obesity drugs is even larger than initially expected, a finding that aligns with our rosy outlook on Eli Lilly (LLY). Meanwhile, commentary from one of Danaher 's (DHR) competitors is sending shares of the Club h…"
N/A,The Investing Club's top 10 things to watch in the stock market Friday,Biztoc.com,2023-07-21T13:38:04Z,"The Club's top 10 things to watch Friday, July 21 1. Stocks are steady ahead of the Nasdaq 100's special rebalance , but be on guard for volatility as the index addresses over-concentration by reducing its weightings in the ""Magnificent Seven."" Did yesterday'…"
N/A,"Meta's Threads Hits 100M Users In Five Days, Foxconn Pulls Out From $19.5B Semiconductor India JV, Novo Nordisk's Weight-Loss Medications Under European Investigation Over Suicidal Risks: Today's Top Stories",Yahoo Entertainment,2023-07-10T16:29:56Z,"Benzinga Meta's Threads Hits 100M Users In Just 5 Days, Becomes Fastest Growing App In History Meta Platforms Inc's (NASDAQ: META) Threads app has hit the..."
N/A,Beware! Ozempic Has A Doppleganger And It Can Be Dangerous,Biztoc.com,2023-07-13T02:42:11Z,"Novo Nordisk NVO, the pharmaceutical giant behind popular semaglutide drugs like Ozempic, Rybelsus, and Wegovy, is making a significant legal push to prevent the sale of semaglutide knockoffs in the U.S., Rolling Stone reports. According to the lawsuits revie…"
N/A,European Regulator Expands Ozempic Probe To Include Other Weight Loss Drugs Over Suicide Risks,Biztoc.com,2023-07-12T03:16:04Z,"On Tuesday, the European Union’s drug regulator expanded its investigation into the risk of suicidal thoughts and self-injury among patients taking weight loss and diabetes medications, including those produced by Novo Nordisk NVO. The probe now encompasses a…"
N/A,"TikTok's Entry Into Music Streaming Raises Concerns For Spotify, Novo Nordisk Accuses Pharmacies Over Illegal Sale Of Obesity Drugs, ChatGPT's Popularity Takes a Hit: Today's Top Stories",Yahoo Entertainment,2023-07-07T15:31:30Z,Reuters TikTok's Entry into Music Streaming Sector Raises Concerns for Spotify's Market Share Spotify Technology S.A. (NYSE: SPOT) could be up for a rough...
N/A,"Trucking Firm Yellow Ceases Operations, Walmart Buys Out Tiger Global's Stake, Former Disney Executives Join As Advisers To CEO Bob Iger: Today's Top Stories",Yahoo Entertainment,2023-07-31T16:13:59Z,"Benzinga Italian Competition Authority Closes Investigation into Google's Alleged Abuse of Dominance, Commits to Enhancing Data Portability The Italian..."
N/A,"Futures: Tesla Dives, But This Was The Key Market Loser",Biztoc.com,2023-07-20T23:38:03Z,"Dow Jones futures were little changed after hours, along with S&P 500 futures and Nasdaq futures. The stock market rally was decidedly mixed Thursday. The Dow Jones rose for a ninth straight session while the Nasdaq suffered its worst loss in more than four m…"
N/A,"Futures: Tesla Dives, But This Was The Key Market Loser",Biztoc.com,2023-07-21T02:52:11Z,"Dow Jones futures edged higher overnight, along with S&P 500 futures and Nasdaq futures. The stock market rally was decidedly mixed Thursday. The Dow Jones rose for a ninth straight session while the Nasdaq suffered its worst loss in more than four months. Te…"
N/A,Portfolio Analysis in Python: The Impact of the Ukraine War on European and American Companies,Biztoc.com,2023-07-27T00:44:23Z,"Photo by Jamie Street on Unsplash On February 24, 2022, an unfortunate and unexpected conflict began between Ukraine and Russia. This article presents an exploration of the financial implications of this war on a specific portfolio comprised of select Europea…"
N/A,"Hollywood Wants To Use AI Replicas Of Actors, Major US Banks Deliver Q2 Earnings, Artificial Sweetener Aspartame Classified As 'Possible Carcinogen:' Today's Top Stories",Yahoo Entertainment,2023-07-14T16:09:14Z,Benzinga Hollywood Wants To Use AI Replicas Of Actors For Eternity And Give Them Just One Day's Pay The tussle between Hollywood studios and the actors...
N/A,"Disney Considers Different Strategies For Star India, Broadcom Wins Conditional European Approval For VMware Deal, Google Deprioritizes Gen Z Chatbot App: Today's Top Stories",Yahoo Entertainment,2023-07-12T15:48:25Z,Wall Street Journal Disney's Dilemma With Star India Aggravated By Mukesh Ambani's Cricket Moves Walt Disney Co (NYSE: DIS) is reportedly considering...
N/A,Δημήτρης Κωστούρος: «…φέτος επιλέξαμε το Φεστιβάλ να έχει άρωμα νεολαίας…»,Naftemporiki.gr,2023-07-09T08:05:16Z,"Το Φεστιβάλ Ναυπλίου, βραβευμένο από την Ένωση Μουσικών Κριτικών Ελλάδας, κλείνει φέτος -υπό την καλλιτεχνική διεύθυνση του Γιάννη Βακαρέλη και με κινητήριο δύναμη τον Δήμο Ναυπλιέων και τον Δήμαρχο Δημήτρη…
Δημήτρης Κωστούρος: «…φέτος επιλέξαμε το Φεστιβάλ ν…"
N/A,16 Low-Cost ETFs to Buy,Yahoo Entertainment,2023-07-05T19:54:26Z,"Expense ratios for index funds have declined in recent years, making them a cheap investing strategy to consider. Here are 16 low-cost ETFs to consider. Low-..."
N/A,Pharma lobbying for weight loss drugs could soon pay off,Yahoo Entertainment,2023-07-23T16:00:27Z,Novo Nordisk has spent millions of dollars over a decade lobbying for obesity drugs to be covered by Medicare. It could soon happen.
N/A,Φεστιβάλ Ναυπλίου: Μεγάλα ονόματα αλλά και νέοι μουσικοί στη φετινή διοργάνωση,Protothema.gr,2023-07-03T13:51:00Z,Θα διεξαχθεί από τις 8 έως τις 16 Ιουλίου - Δείτε το αναλυτικό πρόγραμμα | Φεστιβάλ Ναυπλίου | Κλασική μουσική | Πολιτισμός
N/A,Novo Nordisk A/S - share repurchase programme,GlobeNewswire,2023-07-10T13:06:00Z,"Bagsværd, Denmark, 10 July 2023 – On 9 May 2023, Novo Nordisk initiated a share repurchase programme in accordance with Article 5 of Regulation No 596/2014 of the European Parliament and Council of 16 April 2014 (MAR) and the Commission Delegated Regulation (…"
N/A,Novo Nordisk A/S - share repurchase programme,GlobeNewswire,2023-07-24T13:08:00Z,"Bagsværd, Denmark, 24 July 2023 – On 9 May 2023, Novo Nordisk initiated a share repurchase programme in accordance with Article 5 of Regulation No 596/2014 of the European Parliament and Council of 16 April 2014 (MAR) and the Commission Delegated Regulation (…"
N/A,Novo Nordisk A/S - share repurchase programme,Marketscreener.com,2023-07-31T11:51:02Z,"(marketscreener.com) Bagsværd, Denmark, 31 July 2023 – On 9 May 2023, Novo Nordisk initiated a share repurchase programme in accordance with Article 5 of Regulation No 596/2014 of the European Parliament and Council of 16 April 2014 and the Commission Delegat…"
N/A,Novo Nordisk A/S - share repurchase programme,Marketscreener.com,2023-07-10T13:07:02Z,"(marketscreener.com) Bagsværd, Denmark, 10 July 2023 – On 9 May 2023, Novo Nordisk initiated a share repurchase programme in accordance with Article 5 of Regulation No 596/2014 of the European Parliament and Council of 16 April 2014 and the Commission Delegat…"
N/A,Novo Nordisk A/S - share repurchase programme,GlobeNewswire,2023-07-03T11:04:00Z,"Bagsværd, Denmark, 3 July 2023 – On 9 May 2023, Novo Nordisk initiated a share repurchase programme in accordance with Article 5 of Regulation No 596/2014 of the European Parliament and Council of 16 April 2014 (MAR) and the Commission Delegated Regulation (E…"
N/A,Novo Nordisk A/S - share repurchase programme,GlobeNewswire,2023-07-31T11:50:00Z,"Bagsværd, Denmark, 31 July 2023 – On 9 May 2023, Novo Nordisk initiated a share repurchase programme in accordance with Article 5 of Regulation No 596/2014 of the European Parliament and Council of 16 April 2014 (MAR) and the Commission Delegated Regulation (…"
N/A,Novo Nordisk A/S - share repurchase programme,Marketscreener.com,2023-07-03T11:05:01Z,"(marketscreener.com) Bagsværd, Denmark, 3 July 2023 – On 9 May 2023, Novo Nordisk initiated a share repurchase programme in accordance with Article 5 of Regulation No 596/2014 of the European Parliament and Council of 16 April 2014 and the Commission Delegate…"
N/A,Novo Nordisk A/S - share repurchase programme,GlobeNewswire,2023-07-17T12:51:00Z,"Bagsværd, Denmark, 17 July 2023 – On 9 May 2023, Novo Nordisk initiated a share repurchase programme in accordance with Article 5 of Regulation No 596/2014 of the European Parliament and Council of 16 April 2014 (MAR) and the Commission Delegated Regulation (…"
N/A,Novo Nordisk A/S - share repurchase programme,Marketscreener.com,2023-07-17T12:52:01Z,"(marketscreener.com) Bagsværd, Denmark, 17 July 2023 – On 9 May 2023, Novo Nordisk initiated a share repurchase programme in accordance with Article 5 of Regulation No 596/2014 of the European Parliament and Council of 16 April 2014 and the Commission Delegat…"
N/A,Novo Nordisk A/S - share repurchase programme,Marketscreener.com,2023-07-24T13:09:02Z,"(marketscreener.com) Bagsværd, Denmark, 24 July 2023 – On 9 May 2023, Novo Nordisk initiated a share repurchase programme in accordance with Article 5 of Regulation No 596/2014 of the European Parliament and Council of 16 April 2014 and the Commission Delegat…"
N/A,The Investing Club's top 10 things to watch in the stock market Friday,CNBC,2023-07-21T13:29:42Z,"Morgan Stanley now projects the global obesity market will reach $77 billion in 2030, with bullish implications for Club name Eli Lilly (LLY)."
N/A,LIVE | Wapens en lovende woorden voor Oekraïne: ‘Een voorbeeld voor de hele wereld’,Www.ad.nl,2023-07-12T11:15:00Z,De Oekraïense president Volodymyr Zelensky is toch tevreden met de uitkomst van de Navo-top. Hij toonde zich dinsdag nog zwaar teleurgesteld dat Oekraïne nog geen uitnodiging krijgt om lid te worden. Maar vooral de militaire steun en veiligheidsgaranties die …
N/A,"LIVE | Russische inlichtingenchef spreekt ‘met hoofd CIA over Oekraïne’, Moskou haalt uit naar G7",Www.ad.nl,2023-07-12T08:24:00Z,"Het hoofd van de Russische inlichtingendienst FSB heeft gebeld met zijn tegenhanger in de Verenigde Staten, het hoofd van de CIA. Hij heeft eind juni met William Burns besproken ‘wat moet gebeuren met Oekraïne’, zegt Sergej Narisjkin tegen het Russische staat…"
N/A,"LIVE | Zelensky toch tevreden over Navo-top, maar 'had beter gekund’, Moskou haalt uit naar G7",Www.ad.nl,2023-07-12T11:15:00Z,De Oekraïense president Volodymyr Zelensky is toch tevreden met de uitkomst van de Navo-top. Hij toonde zich dinsdag nog zwaar teleurgesteld dat Oekraïne nog geen uitnodiging krijgt om lid te worden. Maar vooral de militaire steun en veiligheidsgaranties die …
N/A,Eli Lilly Buys Versanis to Boost Its Obesity Drug Portfolio,Investopedia,2023-07-14T20:47:52Z,"Eli Lilly agreed to buy biopharma firm Versanis for up to $1.93 billion, boosting Lilly's reach into the obesity drug market."
N/A,"Bullish developments for three stocks across sectors — and our take, too",CNBC,2023-07-21T18:49:46Z,Here's our full take on the headlines and their implications for our investments in the three companies.
N/A,"Eli Lilly Says Weight-Loss Drug Helps Patients Lose 26% of Their Weight, More Than Rivals",Investopedia,2023-07-27T21:43:12Z,"Eli Lilly said that two Phase 3 trials of its weight-loss drug tirzepatide showed patients lost 26.6% of their body weight on average, more than competitors."
N/A,"As Ozempic/Wegovy frenzy continues, Morgan Stanley lifts forecasts for weight-loss drugs to $77 billion",MarketWatch,2023-07-21T09:05:00Z,"Morgan Stanley on Friday lifted its forecast for weight-loss drugs to $77 billion, as patient demand for the medicines has outstripped supply and been fueled by a social-media frenzy."
N/A,Lilly Adds to Obesity Drug Pipeline With Versanis Buy,Barron's,2023-07-14T15:39:54Z,"Lilly reached a deal to buy Versanis Bio, a privately held biotech which is testing a monoclonal antibody drug called bimagrumab as a new treatment for obesity."
N/A,Exploration Update Focused On Discovery Success In 2023,Marketscreener.com,2023-07-18T14:41:02Z,"(marketscreener.com) HIGHLIGHTS 8,000 m of drilling planned for H2 2023 across key Pilbara prospects and Belltopper gold project in Victoria1. Drill programs are expected to support future shareholder value and planned ASX dual listing process, which remains …"
N/A,Exploration Update Focused On Discovery Success In 2023,GlobeNewswire,2023-07-18T14:40:00Z,"HIGHLIGHTS    8,000 m of drilling planned for H2 2023 across key Pilbara prospects and Belltopper gold project (“Belltopper”) in Victoria1. Drill..."
N/A,Shares of Lilly and Novo Are Down. Are Ozempic Safety Concerns to Blame?,Barron's,2023-07-12T18:50:15Z,A report earlier this week raised questions about whether Ozempic and another Novo drug could be linked to suicidal thoughts.
N/A,40 Investment Ideas From our Roundtable Pros,Barron's,2023-07-14T18:56:43Z,"Our 10 Midyear Roundtable panelists see value in a variety of healthcare, industrial, media, and other stocks that the market has overlooked."
N/A,False claim the Dutch are euthanizing people to ‘save the planet' | Fact check,USA Today,2023-07-06T21:58:22Z,Medically assisted euthanasia in the Netherlands is performed only upon the patient’s request and follows strict legal procedures.
N/A,"Hot rods, hästkrafter och hårvax på raggarmötet",Aftonbladet.se,2023-07-07T19:30:00Z,"Sol, regn, sol och åter regn — 2023 års upplaga av den stora bilträffen Summer meet är nu i full gång.  – Jag har varit"
N/A,SMHI varnar för skyfallsliknande regn,Www.dn.se,2023-07-12T04:44:44Z,SMHI har utfärdat en gul varning för skyfallsliknande regn och åska i södra Sverige. Ovädret väntas pågå fram till 11.00 på onsdagsförmiddagen.
N/A,Regn stoppade Leo Borgs kvällsmatch i Båstad,Www.dn.se,2023-07-19T20:54:17Z,
N/A,Ostadigt med regn – kanske bättre i helgen,Aftonbladet.se,2023-07-04T16:03:19Z,▸ Vädret blir fortsatt ostadigt de närmaste dagarna med ihållande regn och skurar. Till helgen kan vädret bli stabilare.
N/A,Semestervädret osäkert: ”Lite regn varje dag”,Aftonbladet.se,2023-07-08T10:18:54Z,Industrisemestern är här.  Den efterlängtade ledigheten tajmar nu med en osäker väderprognos. – Det blir ett mer ostabil
N/A,"Regn og atter regn: Juli blev den vådeste, som nogensinde er målt",Www.dr.dk,2023-08-01T03:34:00Z,
N/A,Ostadigt väder med regn och solglimtar väntar,Aftonbladet.se,2023-07-23T14:31:56Z,"Ostadigt väder med regn och en del solglimtar väntar under veckan. – Typiskt svenskt sommarväder, säger Lars Knutsson, m"
N/A,Många döda efter kraftiga regn i Afghanistan,Aftonbladet.se,2023-07-23T17:26:53Z,Minst 31 personer har dött och flera saknats i Afghanistan efter kraftiga monsunregn som orsakat översvämningar och jord
N/A,Nyd formiddagens sol: Regn og torden lurer,Www.dr.dk,2023-07-30T05:24:00Z,­
N/A,Ostadigt väder väntar i hela landet,Aftonbladet.se,2023-07-15T17:11:29Z,▸ Efter lördagens soliga väder väntar nu regn och lägre temperaturer i stora delar av landet.
N/A,Is Regeneron Stock a Buy After a Regulatory Blow?,Motley Fool,2023-07-07T11:00:00Z,Don't write this company's eulogy too fast.
N/A,Platserna där det fallit mest regn i sommar,Www.dn.se,2023-07-30T17:57:18Z,Shoppingmecka värst drabbat: ”Vi gör den bästa juli någonsin” • Sommarens regnliga.
N/A,Blött väder drar sig norrut i nästa vecka,Aftonbladet.se,2023-07-08T17:05:04Z,"Sol i norr, regn i syd, allt blötare i mellersta Sverige. Så kan de närmaste dagarnas väder sammanfattas. – Ostadigt väd"
N/A,Regnet får svenskar att panikboka resor till skräckvärmen,Aftonbladet.se,2023-07-18T14:15:15Z,Den europeiska skräckvärmen avskräcker inte.  Regn och svalare väder som dragit in över landet har fått svenskar att pan
N/A,SMHI: Ostadigt väder de närmaste dagarna,Aftonbladet.se,2023-07-02T14:19:03Z,Ostadigt väder med regn och skurar väntas i Sverige de närmaste dagarna. Vädret kan sedan stabiliseras under andra halva
N/A,Tyfonen Doksuri drabbar norra Filippinerna,Aftonbladet.se,2023-07-26T06:40:52Z,Tyfonen Doksuri har drabbat norra Filippinerna med hårda vindar och regn på onsdagen. Närmare 16 000 invånare har tvinga
N/A,Varning för kraftigt regn hävd – men mer på väg,Www.dn.se,2023-07-01T20:43:22Z,
N/A,Ovanligt varm julihelg – sedan väntar regn i hela landet,Www.dn.se,2023-07-08T08:22:20Z,
N/A,Efter regnet – då kan värmen komma tillbaka,Expressen.se,2023-07-02T10:11:39Z,"Stora delar av landet har fått gassande sol i veckor, men nu är regnet här. – Det blir regn, regn, regn, regn, säger meteorolog Pall Agust Thorarinsson om veckan. Men prognosen visar även när värmen väntas komma tillbaka."
N/A,Kraftiga skurar drar in över Gävleborg: ”En hel månads regn”,Www.dn.se,2023-07-25T13:56:16Z,
N/A,Regn väntas i hela landet – då kommer sommarvärmen tillbaka,Aftonbladet.se,2023-07-03T17:40:31Z,På västkusten blåser kraftiga vindar över havet och runt om i landet väntas ett par rejält regniga dagar. Men håll ut –
N/A,Meteorologen: Så undviker du regnet,Svenska Dagbladet,2023-08-01T12:35:37Z,"Regn, regn och ännu mer regn. Så lyder väderprognosen för inledningen av augusti, enligt SMHI:s meteorolog Emelie Karlsson. Men hon har ett bra tips för alla som vill hitta bästa vädret."
N/A,Då kommer värmen: ”En markant höjning”,Expressen.se,2023-07-22T19:24:23Z,"Sommarvärmen som svenskarna fick smaka på i juni verkar vara ett minne blott. Nu visar prognosen regn, regn, regn och regn. – Tyvärr för alla de som har semester nu, säger meteorologen Josefine Qvarnesjö-Bergstedt."
N/A,Tusentals på flykt efter kraftiga översvämningar i Kina – flera döda,Www.dn.se,2023-07-05T09:54:44Z,Kraftigt regn och översvämningar har tvingat tusentals personer på flykt från sina hem i Kina. Byggnader och broar har kollapsat på grund av de kraftiga strömmarna.
N/A,Hundratals döda i extrema monsunregn i Indien,Aftonbladet.se,2023-07-14T08:36:16Z,Över 100 människor har omkommit till följd av de kraftiga monsunregn som drabbat norra delarna av Indien. Och mer regn ä
N/A,Massiv regn kræver yderligere fem ofre i Sydkorea,Www.dr.dk,2023-07-16T04:32:00Z,­
N/A,DMI varsler risiko for kraftig regn og lokale skybrud onsdag,Www.dr.dk,2023-07-04T19:15:00Z,­
N/A,Mycket liten brandrisk – tack vare regnet,Aftonbladet.se,2023-07-18T17:06:49Z,Brandsommaren som många fruktade ser inte ut att bli av. Efter en varm försommar har juli präglats av regn – och brandri
N/A,Tillfällig lättnad för skogsbrandsrisken,Www.dn.se,2023-07-03T09:13:11Z,Regn och rusk kommer till största del prägla inledningen av veckan. Att lågtrycket nu drar över områden där det är väldigt torrt lindrar den annars stora skogsbrandsrisken.
N/A,I dag får vi både sol og regn,Www.dr.dk,2023-07-11T04:38:00Z,­
N/A,SMHI varnar för skyfallsliknande regn,Svenska Dagbladet,2023-07-12T04:40:20Z,"SMHI har utfärdat en gul varning för skyfallsliknande regn och åska i södra Sverige. Ovädret väntas pågå fram till 11.00 på onsdagsförmiddagen. Det är södra Halland, Skåne, västra Kronoberg och västra Blekinge som omfattas av den gula varningen. Enligt SMHI ä…"
N/A,Oversvømmelser koster 22 mennesker livet i det nordlige Indien,Politiken.dk,2023-07-10T06:06:37Z,"Broer, veje og hytter er blevet skyllet væk af store mængder regn i flere indiske delstater i weekenden."
N/A,Regn ødelagde det hele: Rune måtte vente i flere timer,Www.bt.dk,2023-07-04T19:13:33Z,"Regn, regn og atter regn..."
N/A,Varning för kraftigt regn hävd,Expressen.se,2023-07-01T20:40:51Z,"Den gula varningen för regn i de sydligaste delarna av Norrland har nu hävts. En del regn kan dock fortsätta i området under lördagskvällen – och mer kan vara på gång under söndagen, varnar SMHI."
N/A,Gult farevarsel for regn – flere togstrekninger stengt,Www.vg.no,2023-07-25T07:39:10Z,Det er sendt ut gult farevarsel for regn for deler av Rogaland og Østlandet og Hordaland.
N/A,Varning för kraftigt regn hävd – men mer på väg,Svenska Dagbladet,2023-07-01T17:30:57Z,"Den gula varningen för regn i de sydligaste delarna av Norrland har nu hävts. En del regn kan dock fortsätta i området under lördagskvällen – och mer kan vara på gång under söndagen, varnar SMHI."
N/A,Många döda efter kraftiga regn i Afghanistan,Svenska Dagbladet,2023-07-23T17:26:54Z,Minst 31 personer har dött och flera saknats i Afghanistan efter kraftiga monsunregn som orsakat översvämningar och jordskred. Även grannlandet Pakistan har drabbats.
