Stock,Title,Source,Published At,Description
N/A,"Les résultats du bac 2023 des filières générales, technologiques et professionnelles",Le HuffPost,2023-07-04T06:00:11Z,"718 723 candidats ont passé le bac en 2023, pour combien d’admis ? Découvrez vos résultats ci-dessous ainsi que ceux de vos proches, académie par académie."
N/A,Émeutes à Marseille : l’homme sorti du coma après un tir de Flash-Ball témoigne,Le HuffPost,2023-07-10T19:57:22Z,Un jeune homme de 22 ans s’en est sorti par miracle début juillet pendant les violences urbaines à Marseille. Il met en cause un équipage de la Bac.
N/A,"Émeutes : Macron, pour sa première sortie depuis la mort de Nahel, se rend dans une caserne de police à Paris",Le HuffPost,2023-07-03T22:37:37Z,"Emmanuel Macron et Gérald Darmanin se sont rendus à la caserne Bessières, dans le 17e arrondissement de Paris, qui accueille notamment les effectifs de la BAC de nuit."
N/A,"Baccalauréat 2023 : 84,9 % d’admis selon les premières estimations, une légère baisse par rapport à 2022",Libération,2023-07-04T06:18:27Z,Les résultats ont commencé à tomber dans l’académie d’Aix-Marseille à partir de 8 heures. Les autres académies suivront à partir de 10 heures.
N/A,EN DIRECT - Mort de Nahel : Emmanuel Macron reçoit ce mardi les maires des 220 communes touchées par les dégradations,Libération,2023-07-04T05:23:08Z,"La désescalade sur le front des violences urbaines semble se confirmer, la soirée de lundi a été calme, aucun incident majeur n’a été signalé. L’heure est au bilan et à l’action politique."
N/A,Porsche 911 to be sole survivor of automaker's combustion models,Autoblog,2023-07-26T13:00:00Z,"Filed under:
 Green,Coupe,Luxury,Performance
 Continue reading Porsche 911 to be sole survivor of automaker's combustion models
Porsche 911 to be sole survivor of automaker's combustion models originally appeared on Autoblog on Wed, 26 Jul 2023 09:00:00 EDT. …"
N/A,"Anaïs et Marine, 17 ans : « Si en soirée, je dis que je ne bois pas, ça provoque des étonnements »",L'Obs,2023-07-14T11:45:13Z,"ALCOOLS (3/4). Dans ce troisième épisode de notre série sur la dépendance, deux lycéennes discutent de leur découverte de la boisson, de leur manière de consommer et de la pression sociale, déjà présente."
N/A,Cheap Bank Stocks: 3 Things to Know Before Buying Bank of America,Motley Fool,2023-07-23T09:07:00Z,"There are some positives, but some reasons for caution, too."
N/A,Mark Hulbert: Top investment newsletters aren’t bullish on Tesla or Meta Platforms. Here’s what they do like.,MarketWatch,2023-07-06T11:25:00Z,The tech sector’s rich valuation turns market pros to banking and other non-high-tech stocks.
N/A,Le taux de réussite au bac 2023 en léger recul par rapport à celui de 2022 (avant rattrapage),Le HuffPost,2023-07-04T06:18:56Z,"Pap Ndiaye, le ministre de l’Éducation, a évoqué un taux de réussite de 84,9 % contre 86,1 % en 2022. Au final, l’an passé, 91 % des candidats avaient eu le bac."
N/A,"Frédéric Veaux, patron de la police, souhaite la libération du policier écroué à Marseille",Le HuffPost,2023-07-23T19:57:52Z,"Un policier de la BAC de Marseille avait été placé en détention provisoire, soupçonné d’avoir passé à tabac un jeune homme de 21 ans dans la nuit du 1er au 2 juillet."
N/A,Guerre en Ukraine : Miron Motulko a appris le français et eu le bac avec mention un an après avoir fui son pays,Le HuffPost,2023-07-08T13:23:41Z,"Arrivé en France avec sa mère et son frère alors qu’il ne parlait pas un mot de la langue, le lycéen a réussi l’exploit d’obtenir son bac avec mention."
N/A,Emeutes à Marseille : les policiers soupçonnés d’avoir tabassé un jeune homme déférés devant un juge,Le HuffPost,2023-07-20T10:15:50Z,"Hedi, 21 ans, aurait reçu un tir de flash ball dans la tempe avant d’être tabassé par des policiers de la Bac lors des émeutes après la mort de Nahel."
N/A,"Live Insta, grilles géantes… Les cruciverbistes essayent de dépoussiérer leur passion",20 Minutes,2023-07-31T09:12:39Z,"Jokari, Mille Bornes ou Petit Bac… L’été et ses longues plages de temps libre sont propices aux jeux : de plage ou de voiture, solitaires ou de société.Toute la semaine, avec sa série d’articles « A quoi tu joues ? », « 20 Minutes » explore les tendances"
N/A,"Le taux de réussite au bac 2023 atteint 90,9 %, en baisse par rapport à 2022",Le HuffPost,2023-07-08T15:28:26Z,"Après trois années marquées par le Covid, le taux de réussite toutes sections confondues et après rattrapage passe sous les 91 %."
N/A,Résultats du bac 2023 : à quelle heure seront-ils connus dans chaque académie ?,Le HuffPost,2023-07-03T16:45:07Z,"Sur le site Cyclades ou directement dans le centre d’examen, les résultats du baccalauréat sont annoncés ce mardi 4 juillet dans toutes les académies."
N/A,Jusqu’à 600 euros de remise : découvrez en avance les offres ECOVACS pour les Prime Day [Sponso],Frandroid,2023-07-07T09:45:18Z,"Les Prime Day commencent le 11 juillet, mais on connait déjà le montant des promotions sur certains modèles. C’est le cas de trois des meilleurs aspirateurs robots ECOVACS qui perdent entre 100 et 600 euros pour quelques jours seulement."
N/A,Prime Day : c’est le moment de vous offrir un aspirateur robot tout-en-un Ecovacs,Presse-citron,2023-07-07T12:30:10Z,"C’est le retour du Prime Day ! Sur Amazon, les aspirateurs robots d’Ecovacs voient leurs prix dégringoler pendant quelques jours seulement. C’est le moment de révolutionner votre quotidien."
N/A,"Marche pour Adama Traoré, guerre en Ukraine : jour 500, 14-Juillet sous haute sécurité… Les cinq infos à retenir du week-end",Le Monde,2023-07-09T17:43:45Z,"Vous n’avez pas suivi l’actualité, samedi 8 et dimanche 9 juillet ? Voici ce qu’il faut retenir de ces dernières quarante-huit heures."
N/A,"Pour le Prime Day, Ecovacs craque et sacrifie ses aspirateurs robots",01net.com,2023-07-07T08:45:12Z,"Arrêtez de perdre de l’énergie à passer l’aspirateur et la serpillère, les prix des aspirateurs robots d’Ecovacs sont en chute libre pendant le Prime Day. Ça commence dès maintenant !"
N/A,Vous cherchez la perle rare ? Ces 2 aspirateurs Eureka sont à prix mini pendant le Prime Day,Journal du geek,2023-07-11T07:45:04Z,"C’est le bon moment pour vous équiper d’un aspirateur efficace ! 
Vous cherchez la perle rare ? Ces 2 aspirateurs Eureka sont à prix mini pendant le Prime Day"
N/A,EA dévoile un jeu Black Panther : à quoi faut-il s’attendre ?,Journal du geek,2023-07-10T17:00:03Z,"Tandis que les équipes de Motive travaillent d'arrache pied sur un jeu Iron Man, EA s'offre un autre héros pour son dernier studio.
EA dévoile un jeu Black Panther : à quoi faut-il s’attendre ?"
N/A,La Xbox déploie enfin sa nouvelle interface pour tout le monde,Journal du geek,2023-07-27T09:30:55Z,"Attendez vous à redécouvrir votre console lorsque cette mise à jour tant attendue fera son entrée dans les jours à venir.
La Xbox déploie enfin sa nouvelle interface pour tout le monde"
N/A,"Test du Xiaomi Mi Robot Vacuum S12 : un robot aspirateur accessible et efficace, mais perfectible",Frandroid,2023-07-21T13:49:59Z,"Xiaomi renforce son offre de robot aspirateur avec un Mi Robot Vacuum S12 qui se veut polyvalent, avec un mode de nettoyage humide des sols, une bonne cartographie et détection d’obstacle, tout cela dans une enveloppe budgétaire serrée de moins de 300 euros."
N/A,"#LeBrief : Sam Altman lance son Worldcoin, hausse de prix Spotify, bac à sable IA à la CNIL, corrections de failles chez Apple",Next INpact,2023-07-26T06:55:05Z,Retrouvez l'actualité en bref de l'informatique et du numérique.
N/A,Gérald Darmanin reçoit les syndicats de policiers jeudi soir,Libération,2023-07-27T07:19:07Z,"De retour de Nouvelle-Calédonie, le ministre de l’Intérieur reprend la main en pleine polémique politique et dans un contexte de protestation chez les fonctionnaires de police après l’incarcération de l’un de leurs collègues."
N/A,Gérald Darmanin a-t-il vraiment dit que la police recrutait des «enfants» ?,Libération,2023-07-10T18:09:52Z,"Lors d’une audition au Sénat sur les violences qui ont suivi la mort de Nahel le 27 juin, le ministre de l’Intérieur a provoqué la colère des syndicats de police en évoquant l’âge et le niveau d’études des policiers et gendarmes."
N/A,"Affaire Hedi : non, sa blessure n’a pas changé de côté au fil de ses prises de parole",Libération,2023-07-31T17:12:33Z,"Victime d’un tir de LBD début juillet à Marseille, Hedi a tourné une vidéo où il revient sur la cagnotte destinée à le soutenir. Les images ont surtout circulé dans des tweets s’attaquant à la véracité de son récit."
N/A,"Actualité : Soldes / Bon plan – Le nettoyeur de sol Kärcher FC 7 sans fil ""5 étoiles"" à 299,99 € (-23%)",Les Numériques,2023-07-02T03:31:02Z,Le nettoyeur de sol Kärcher FC 7 sans fil passe sous les 300 € chez Amazon soit une baisse d'environ 23% sur le prix habituellement constaté. C'est actuellement l'un des meilleurs produit de notre comparatif.
N/A,"Actualité : Soldes / Bon plan – Le nettoyeur de sol Kärcher FC 7 sans fil ""5 étoiles"" à 299,99 € (-18%)",Les Numériques,2023-07-05T08:37:02Z,Le nettoyeur de sol Kärcher FC 7 sans fil passe sous les 300 € chez Amazon soit une baisse d'environ 18% sur le prix habituellement constaté. C'est actuellement l'un des meilleurs produit de notre comparatif.
N/A,"Actualité : Prime Day 2023 – La cafetière automatique avec broyeur Siemens EQ.6+ S500 ""4 étoiles"" à 639,99 €",Les Numériques,2023-07-10T22:36:00Z,La cafetière automatique avec broyeur Siemens EQ.6+ S500 passe sous les 650 € chez Amazon Prime.
N/A,Oh la boulette ! Trois recettes à faire avec un moule à falafel,Le Monde,2023-07-25T10:00:11Z,"Ces petites boules végétales faites avec des pois chiches ou des fèves sont généralement modelées à la main. Pour peu que le nombre de convives soit élevé, il peut être utile d’investir dans un de ces moules en forme de lampe torche."
N/A,Eureka ratatine les prix de 2 aspirateurs ultra pratiques,Presse-citron,2023-07-09T08:15:53Z,"Vous êtes plutôt aspirateur-balai ou aspirateur traîneau ? Dans tous les cas, Eureka dévoile des remises inouïes pendant le Prime Day sur Amazon."
N/A,Outside the Box: Banks are making it tougher to get a mortgage. Home buyers deserve better.,MarketWatch,2023-07-25T20:11:00Z,Here’s how the U.S. should strengthen home lending institutions.
N/A,La proposition de Pap Ndiaye d’une notation plus sévère de l’orthographe n’est pas la solution pour ces profs,Le HuffPost,2023-07-10T10:14:33Z,"Évoquant les nombreuses coquilles dans les copies du baccalauréat, le ministre de l’Éducation nationale a annoncé vouloir pénaliser les fautes d’orthographe des élèves français. Une solution qui ne convainc pas les enseignants."
N/A,A Hidden Gem: The Bank Stock Flying Under The Radar,Biztoc.com,2023-07-21T11:12:05Z,"We've already kicked off our coverage of the financial sector's earnings season, with some of the titans like Goldman Sachs Group Inc NYSE: GS among the heaviest traded stocks this week. But there's one bank stock, whose roots go back even further than Goldma…"
N/A,"Bank of America profit jumps on boost from interest income, investment banking - Reuters",Google News,2023-07-18T11:13:00Z,"<ol><li>Bank of America profit jumps on boost from interest income, investment banking  Reuters
</li><li>Bank of America (BAC) earnings 2Q 2023  CNBC
</li><li>Bank of America net income jumps 19%, extending the rally for big banks  Yahoo Finance
</li><li>V…"
N/A,"Stock Market News Today, 7/18/23",Biztoc.com,2023-07-18T21:54:09Z,"Stock indices finished today’s trading session in the green. The S&P 500 (SPX), the Nasdaq 100 (NDX), and the Dow Jones Industrial Average (DJIA) gained 0.71%, 0.82%, and 1.06%, respectively. The real estate sector (XLRE) was the session’s laggard, as it lost…"
N/A,"Crypto Catalysts: Investors to Weigh Jobs, Retail Sales, Production Data for Latest Inflation Signals",Biztoc.com,2023-07-17T20:18:12Z,"Crypto investors will be eyeing a flurry of U.S. jobs, housing and other macroeconomic data this week for signs of their dream scenario: that inflation is waning without casting the economy into a steep recession. To be sure, even a continuation of recent enc…"
N/A,"Netflix Posts Subscribers’ Growth and Impressive Financials, Analysts Raise NFLX Price Target",Biztoc.com,2023-07-03T12:30:06Z,"Coinspeaker Netflix Posts Subscribers’ Growth and Impressive Financials, Analysts Raise NFLX Price Target From being a mail-order movie service Netflix (NASDAQ: NFLX) has become a global content powerhouse with millions of subscribers worldwide, contributing …"
N/A,"Actualité : Soldes / Bon plan – Le nettoyeur de sol Kärcher FC 7 sans fil ""5 étoiles"" à 299,99 € (-22%)",Les Numériques,2023-07-03T03:31:20Z,Le nettoyeur de sol Kärcher FC 7 sans fil passe sous les 300 € chez Amazon soit une baisse d'environ 22% sur le prix habituellement constaté. C'est actuellement l'un des meilleurs produit de notre comparatif.
N/A,Une feuille de route européenne pour le métavers et le web 4.0,01net.com,2023-07-12T06:00:26Z,"Le métavers a eu son heure de gloire, porté par les milliards de dollars d'investissement de Meta qui ont accouché d'une souris, du moins pour le moment. Mais qui sait, peut-être que les envies de vivre dans des univers complètement virtuel reviendront nous h…"
N/A,Opposition likely to boycott Rajya Sabha Business Advisory Committee meeting to press for PM Modi statement on Manipur,Moneycontrol,2023-07-27T04:07:55Z,"The Rajya Sabha BAC has 11 members including the Vice President as its ex-officio chairman. Three MPs from the 26-member INDIA are on the BAC committee -- one each from Congress, RJD and TMC."
N/A,5 formations pour maîtriser les réseaux informatiques,Blogdumoderateur.com,2023-07-26T07:21:13Z,"Découvrez notre sélection de formations dédiée à la configuration, l'administration et la maintenance des réseaux informatiques."
N/A,Test Lave-linge Hisense W1014FQRT : de gros besoins en eau,Les Numériques,2023-07-22T05:00:00Z,"Le lave-linge Hisense W1014FQRT adopte une position tarifaire très agressive puisque, pour moins de 750 €, on peut acquérir un modèle d'une capacité de 10 kg, boosté au distributeur automatique de lessive et pourvu de fonctionnalités vapeur."
N/A,Bac A Bank khai trương trụ sở mới tại Thanh Hóa,Vnexpress.net,2023-07-11T17:27:36Z,"Thanh Hóa- Chi nhánh mới của Bac A Bank tọa lạc trên đại lộ Lê Lợi, phường Đông Hương, TP Thanh Hóa, bắt đầu hoạt động từ 8/7."
N/A,"Un policier « n’a pas sa place en prison » : La justice « seule légitime » pour décider, rappelle le CSM",20 Minutes,2023-07-24T17:29:02Z,"La polémique a enflé, poussant le Conseil supérieur de la magistrature (CSM) à intervenir. La justice est « la seule légitime pour décider du placement ou non en détention provisoire des personnes qui lui sont présentées », a rappelé l’instance ce lundi.C"
N/A,Pratiquez les bases de l'astronomie observationnelle professionnelle avec C2PU,Futura,2023-07-10T19:01:10Z,"Depuis un an, l’Observatoire de la Côte d’Azur (OCA) rend disponible sur dossier la formation du module d'astronomie observationnelle de son master d'astrophysique en distanciel. Toute personne ayant acquis des connaissances correspondant à un niveau Bac+3 sc…"
N/A,"Best-seller du Prime Day, cet aspirateur balai Tineco humilie Dyson (et il est 2x moins cher) ",Journal du geek,2023-07-12T07:15:54Z,"Parmi les offres phares de ce Prime Day, le Tineco Floor One S5 caracole en tête des ventes sur Amazon. Grâce à une très belle remise de près de -30%, son prix s'effondre comme jamais auparavant. 
Best-seller du Prime Day, cet aspirateur balai Tineco humilie …"
N/A,3 aspirateurs Roborock à prix sacrifiés pendant le Prime Day,Journal du geek,2023-07-11T07:15:39Z,"Sur Amazon, c’est l’heure de révolutionner votre quotidien avec des promotions inouïes sur de nombreux aspirateurs Roborock. Zoom sur les meilleures offres du moment.
3 aspirateurs Roborock à prix sacrifiés pendant le Prime Day"
N/A,"Plus fort que Black Friday, ce deal sur le iRobot Roomba i7+ est une dinguerie totale (-47%) ",Journal du geek,2023-07-26T10:46:02Z,"Le robot aspirateur ultra haut de gamme iRobot Roomba i7+ profite d'une remise exceptionnelle de -47% chez Darty. Une occasion en or pour s'en équiper à un prix tout bonnement incroyable.
Plus fort que Black Friday, ce deal sur le iRobot Roomba i7+ est une di…"
N/A,3 offres Xiaomi immanquables pendant le Prime Day,Journal du geek,2023-07-11T14:45:51Z,"Il est l’heure de vous équiper d’un aspirateur robot. Si vous êtes à la recherche d’un fidèle compagnon, Xiaomi écrase les prix de ses nouveaux aspirateurs robots pendant le Prime Day. Ne passez pas à côté !
3 offres Xiaomi immanquables pendant le Prime Day"
N/A,Bank of America (BAC) Outpaces Stock Market Gains: What You Should Know,Yahoo Entertainment,2023-07-03T21:45:20Z,"Bank of America (BAC) closed the most recent trading day at $29.20, moving +1.78% from the previous trading session."
N/A,What Makes Bank of America Corporation (BAC) a Safe Stock?,Yahoo Entertainment,2023-07-05T07:44:52Z,"ClearBridge Investments, an investment management company, released its “ClearBridge Large Cap Value Strategy” first quarter 2023 investor letter. A copy of ..."
N/A,Should You Hold Bank of America Corporation (BAC)?,Yahoo Entertainment,2023-07-12T11:15:20Z,"Oakmark Funds, advised by Harris Associates, released its “Oakmark Equity and Income Fund” second quarter 2023 investor letter. A copy of the same can be..."
N/A,"EN DIRECT - 100 jours, émeutes, rentrée… Suivez l’interview d’Emmanuel Macron aux JT de 13 heures",Libération,2023-07-24T10:04:10Z,"Pour clore la séquence politique du remaniement et tracer des perspectives pour la rentrée, le chef de l’Etat est interviewé sur TF1 et France 2 ce lundi 24 juillet depuis la Nouvelle-Calédonie."
N/A,Les prix des meilleurs aspirateurs Roborock sont au plus bas pour les Prime Day [Sponso],Frandroid,2023-07-11T05:32:21Z,"Acteur historique de l'univers des aspirateurs-robots, Roborock n'échappe pas à la tradition des Prime Day. Au programme de ces deux jours : d'importantes remises sur les appareils premium du constructeur."
N/A,"Hedi, blessé par des policiers à Marseille, livre un témoignage bouleversant : « Une partie de moi n’y croit toujours pas »",Le HuffPost,2023-07-27T06:22:37Z,"Dans une interview à « Konbini », le jeune homme de 21 ans a témoigné de sa terrible agression par des policiers marseillais, début juillet."
N/A,"Harissa, allumez le feu",Libération,2023-08-01T07:05:00Z,"Aujourd’hui, une pâte rouge qui pimente notre vie."
N/A,Roborock Q7 Max+ : Amazon lave le prix de cet aspirateur-robot pendant les Prime Day,Frandroid,2023-07-11T07:55:49Z,"Le Roborock Q7 Max+ est le flagship, l'appareil haut de gamme de référence, de la marque Roborock. Cet excellent aspirateur-robot doté d'une station de vidage voit son prix tomber à 579 euros pendant les deux prochains jours."
N/A,Chủ thẻ tín dụng Bac A Bank nhận ưu đãi tại TH truemart,Vnexpress.net,2023-07-03T02:15:26Z,"Khi sử dụng thẻ Bac A Bank MasterCard để mua sắm tại chuỗi cửa hàng TH truemart trên toàn quốc, chủ thẻ sẽ được hoàn tiền 10% giá trị hóa đơn (tối đa 100.000 đồng)."
N/A,How Can Schools Respond To Book Bans And Policing?,Teachthought.com,2023-07-26T01:31:57Z,"Schools can respond to book banning and policing by shifting emotionally charged conversations bac to children and the purpose of school.
The post How Can Schools Respond To Book Bans And Policing? appeared first on TeachThought."
N/A,"Hedi blessé par des policiers, la Macronie botte en touche après son témoignage",Le HuffPost,2023-07-27T10:10:10Z,Le jeune homme de 21 ans a livré à Konbini sa version des faits de son agression par des policiers à Marseille début juillet.
N/A,Gérald Darmanin s’explique après ses propos sur les policiers « qui n’ont pas fait de grandes études »,Le HuffPost,2023-07-12T07:29:34Z,"Le ministre de l’Intérieur assure que ses propos ont été « mal interprétés » et met en avant son propre parcours, « issu d’un milieu très modeste, sans grand diplôme »."
N/A,Prime Day : Simplifiez-vous la vie avec ces offres folles sur les aspirateurs Roborock,Presse-citron,2023-07-11T13:15:28Z,Le retour du Prime Day est l’occasion parfaite pour remiser les meilleurs aspirateurs de Roborock. Voici le top 3 des offres Roborock à saisir d’urgence sur Amazon.
N/A,Prime Day 2023 : Top 3 des aspirateurs robots Xiaomi en promotion,Presse-citron,2023-07-12T06:45:29Z,Vous rêvez d’un aspirateur robot ? Xiaomi fracasse les prix de ses meilleurs aspirateurs robots à l’occasion du Prime Day. C’est maintenant ou jamais !
N/A,Big Banks Top Q2 Estimates But Fail To Excite The Market As Caution Is In The Air,Yahoo Entertainment,2023-07-18T20:20:48Z,Bank of America Corporation (NYSE: BAC) posted a second quarter profit that beat analyst forecasts as the company boosted interest income due to higher...
N/A,"If You Invested $10,000 in Bank of America in 2010, This Is How Much You Would Have Today",Motley Fool,2023-07-23T13:15:00Z,"Bank of America has been a good stock to own since the start of 2010, but what if you play with the time frame?"
N/A,55.3% of Warren Buffett's $380 Billion Portfolio Is Invested in These 2 Dividend Stocks,Motley Fool,2023-07-27T13:05:00Z,Want to know what Buffett's favorite stocks are? You don't have to guess.
N/A,Prime Day : ces 2 aspirateurs sont victimes de remises à couper le souffle,01net.com,2023-07-10T13:15:32Z,"Pendant quelques jours d’exception, vous pouvez vous offrir un aspirateur Eureka à prix sacrifié chez Amazon. Dépêchez-vous d’en profiter !"
N/A,Why Bank of America Stock Fell 13.4% in the First Half of 2023,Motley Fool,2023-07-14T20:11:18Z,"The megabank had a surprisingly good first half, despite the drop."
N/A,"Marseille : Quatre policiers mis en examen pour violences en réunion, un placé en détention provisoire",20 Minutes,2023-07-21T06:43:39Z,"Le parquet avait requis leur détention provisoire. Au final, seul l’un des quatre policiers soupçonnés d’avoir violemment frappé un jeune homme à Marseille en marge des émeutes qui ont suivi la mort de Nahel a été écroué, a annoncé le parquet ce vendredi."
N/A,"Policier incarcéré à Marseille : « Il y a certains moutons noirs qu’il faut écarter du troupeau », réclame Hedi",20 Minutes,2023-07-31T10:15:34Z,"Interrogé longuement sur BFMTV, le jeune Hedi qui a reçu un tir de LBD sur la tempe en marge des émeutes à Marseille a redit sa « foi en la justice » et déploré le manque de soutien de l’Etat à son encontre.Le jeune homme qui a perdu une partie de la boît"
N/A,Le top 5 des applications à ne pas manquer ce week-end,Clubic,2023-07-08T10:00:00Z,Le week-end est bientôt là ! Il est l'heure de vous dévoiler les cinq applications qui nous ont tapé dans l'œil cette semaine.
N/A,"BSP to abstain from discussions, voting on NCT Amendment Bill in Parliament",The Indian Express,2023-07-21T06:35:19Z,"The Delhi ordinance was described by the AAP as a violation of the principle of federalism by sidelining an elected government and handing over control of civil servants to the L-G. On Thursday, the BRS too joined the Opposition MPs’ walkout over the issue."
N/A,Banking Sector Meltdown Impacted Bank of America Corporation (BAC) in Q1,Yahoo Entertainment,2023-07-05T11:07:50Z,"Smead Capital Management, an investment management company, released its “Smead Value Fund” first quarter 2023 investor letter. A copy of the same can be..."
N/A,Statistical Arbitrage – An Easy Walkthrough,Github.io,2023-07-18T01:20:37Z,Statistical arbitrage (stat arb) is a pillar of quantitate trading that relies on mean reversion to predict the future returns of an asset. Mean reversion believes that if a stock has risen higher it’s more likely to revert in the short term which is the oppo…
N/A,Bond Report: U.S. bond yields creep back up after 2-year yield’s biggest drop since March,MarketWatch,2023-07-14T11:39:00Z,"Treasury yields were slightly higher on Friday, a day falling for most the past week helped by signs of slowing U.S. inflation."
N/A,JPMorgan Chase (JPM) Q2 2023 Earnings Call Transcript,Motley Fool,2023-07-14T19:30:23Z,"JPM earnings call for the period ending June 30, 2023."
N/A,$JPM JPMorgan Q2 2023 Earnings,Biztoc.com,2023-07-14T10:52:07Z,"Adj. Rev. $42.40b, est. $39.34b Eps $4.75, est. $3.83"
N/A,Market Snapshot: U.S. stock futures inch lower as JPMorgan and other banks get ready to report,MarketWatch,2023-07-14T09:58:00Z,"Investors are bracing for bank results on Friday, a day after the S&P 500 retook a level it hasn't seen since April. Stock futures are inching south."
N/A,"The Ratings Game: Upstart may be gearing up for a big beat, but does its stock already reflect that?",MarketWatch,2023-07-25T18:11:00Z,"Upstart shares were surging after an analyst said he thought the company's was getting ready to report a ""strong top-line beat"" for its most recent quarter."
