Stock,Title,Source,Published At,Description
N/A,nubia Red Magic Gaming Tablet's battery size and charging speed confirmed,GSMArena.com,2023-07-02T22:22:01Z,"nubia will unveil the Red Magic 8S Pro and Red Magic Gaming Tablet on July 5 in China. The company recently revealed that the Red Magic 8S Pro will pack a 6,000 mAh battery with 165W charging support, and now the brand has announced that the Red Magic Gaming …"
N/A,40% off Select Saucony Best-Sellers w/ code + Free Express Shipping,Slickdeals.net,2023-07-12T16:22:17Z,"Saucony offers 40% Off select Saucony Best Seller Footwear Styles when you apply coupon code SUMMERSAVINGS at checkout during their Summer Savings event. Shipping is free .  

Thanks to Slickdeals s ..."
N/A,Weekly poll results: the ZTE nubia Z50S Pro wins is a potential hit,GSMArena.com,2023-07-30T00:12:01Z,"Last week’s poll shows that the ZTE nubia Z50S Pro has a lot of potential – some are holding off until they can see what this phone can do before making their mind up, but for the most part people love the new Pro.

Its gaming-focused cousin, the Red Magic 8S…"
N/A,RedMagic: Gaming-Tablet wird seinen Akku mit 10.000 mAh mit 80 Watt aufladen,Caschys Blog,2023-07-04T05:30:13Z,"nubia plant ein Gaming-Tablet seiner Marke RedMagic. Zu den technischen Daten sind zwar noch einige Fragen offen, doch über das chinesische Social Network Weibo hat man immerhin schon bekannt gegeben, dass der Akku auf beachtliche 10.000 mAh kommen werde. Zud…"
N/A,"Your Favorite Addictive Flash Games, Back From the Dead",kottke.org,2023-07-20T21:50:47Z,Long-time readers will recall that I used to link to Flash games pretty regularly. They were typically easy to play and hard to pu
N/A,"12 GB de RAM, pantalla a 144 Hz y diseño premium por solo 322 euros",La Vanguardia,2023-07-04T12:30:17Z,"Si estás buscando un móvil con carqacterísticas de gama alta y que te cueste muy poco dinero, uno de los mejores ZTE acaba de tumbar su precio. Puedes hacerte con el ZTE Axon 40 Pro 5G por solo 322 euros en Amazon o . Su precio habitual se sitúa por encima de…"
N/A,"Weekly poll: the ZTE nubia Z50S Pro is an all-round powerhouse, but is it right for you?",GSMArena.com,2023-07-23T10:33:01Z,"The new nubia Z50S Pro is the second phone with the Snapdragon 8+ Gen 2, following the launch of the related Red Magic 8S Pro. This one is focused more on the camera than gaming, but there are a lot of similarities between the two as well.

Starting with the …"
N/A,A New Approach to M.S. Could Transform Treatment of Other Diseases,The New Yorker,2023-07-17T10:00:00Z,"Multiple sclerosis was once seen as a “dead-end disease,” Rivka Galchen writes. But lots of little interventions have added up to remarkable progress. Should that change how we take on other conditions?"
N/A,The Pixel 8’s rumored cameras could fix my biggest gripes with the Pixel 7,Android Authority,2023-07-09T14:00:46Z,"The Google Pixel 8 family's camera upgrades recently leaked, and it looks like the new phones could fix a few major Pixel 7 bugbears."
N/A,EXGBoost: Gradient Boosting in Elixir,Dockyard.com,2023-07-26T16:42:52Z,The latest machine learning addition to the Elixir ecosystem gives you the ability to use gradient boosting without leaving the Elixir ecosystem.
N/A,How do brain cells send messages?,Live Science,2023-07-25T11:00:52Z,"Brain cells, or neurons, have multiple means of communication, and their chatter may be influenced by the cells around them, research suggests."
N/A,"Police Are Putting More Drones in the Skies, But Are We Safer?",PetaPixel,2023-07-30T13:00:57Z,"While PetaPixel editor-in-chief Jaron Schneider implores drone manufacturers to make drones compelling enough to jump through regulatory hoops in the United States, law enforcement and first responders in the United States are finding plenty of reasons to fly…"
N/A,The Boom in Immersive Technology,Motley Fool,2023-07-15T12:00:00Z,"Investors can look at Apple, Meta Platforms, and some less obvious choices."
N/A,Soldes 2023 : voici le TOP des offres Tech à ne pas manquer de la 3e démarque,Frandroid,2023-07-19T08:13:23Z,"C’est la troisième démarque des soldes d’été et ce que l'on peut vous dire c'est qu'il y a encore des bonnes affaires à saisir. Retrouvez toutes les meilleures offres dans notre sélection, fait avec cœur."
N/A,"Trust Gaming GXT 620, la soundbar compatta di qualità crolla di prezzo su Amazon",Webnews.it,2023-07-14T09:00:05Z,"Trust Gaming GXT 620 Axon Soundbar Illuminata RGB 12W, Alimentazione USB, 3.5mm AUX, Altoparlanti, Casse PC per Computer, Laptop, Smartphone, Tablet, TV - Nero"
N/A,From Python to Elixir Machine Learning,Thestackcanary.com,2023-07-25T09:04:21Z,Moving on from Python Machine Learning might seem impossible. Let me break down why and how you can do it.
N/A,Seis apuestas para aprovechar el tirón de las empresas en crecimiento,Expansion.com,2023-07-14T23:14:32Z,"Después de un primer semestre del año muy rentable, las principales bolsas del mundo han entrado en una fase de indefinición. Antes de dar nuevos pasos, el mercado quiere escudriña"
N/A,Boeing and 17 Other Money-Losing Companies That Are About to Turn a Profit,Barron's,2023-07-13T14:32:00Z,"Companies that go from losing money to earning money tend to outperform the market. Look to travel stocks, Boeing, Uber, and PG&E."
N/A,ZTE 中兴 Axon 40 Pro 5G智能手机 12GB+256GB 1698元,Smzdm.com,2023-07-29T08:36:23Z,京东手机自营旗舰店此款商品售价1698.00元，近期好价。
N/A,ZTE 中兴 plus会员中兴Axon40Pro 12GB+256GB极光绿 双模5 G拍照手机 1648.00元 1648元,Smzdm.com,2023-07-31T09:38:08Z,"ZTE 中兴 plus会员中兴Axon40Pro 12GB+256GB极光绿 双模5 G拍照手机 1648.00元 1648元,什么值得买甄选出京东优惠促销商品,包括ZTE/中兴报价、多少钱等信息,认真生活,好好花钱就上什么值得买。"
N/A,I always wondered how you can be a university president & on the board of pharmaceutical companies & run a gigantic research lab,Freethoughtblogs.com,2023-07-20T11:47:41Z,"I know that guy! That’s Marc Tessier-Lavigne! He’s about my age, and we shared similar interests — we were both interested in axon guidance, and I followed his work avidly some years ago. He was publishing about netrins, signaling molecules that affect the tr…"
N/A,CORSAIR unveils NIGHTSABRE Wireless RGB Gaming Mouse and K65 PRO MINI Keyboard,BetaNews,2023-07-13T21:44:32Z,"Today, CORSAIR unveiled two new PC gaming accessories -- the NIGHTSABRE Wireless Gaming Mouse and K65 PRO MINI Optical-Mechanical Gaming Keyboard. The NIGHTSABRE wireless gaming mouse, with its symmetrical design, satisfies all gamer preferences while providi…"
N/A,Learning needs to be effortful to be effective,Giansegato.com,2023-07-04T01:02:25Z,"Online content makes edutainment the norm among curious and intelligent people, who don't realize that they aren't actually learning what they think they are."
N/A,Two Insiders Scooped Up Taser-Maker Axon Stock in May and June,Fintel.io,2023-07-07T02:30:24Z,Two insiders have been buying shares of Axon Enterprises in recent weeks.
N/A,Soldes 2023 : c’est le moment de faire le plein de bonnes affaires durant la 3e démarque,Frandroid,2023-07-21T08:07:41Z,"Les soldes d'été ont été lancés en France depuis quelques semaines, et plusieurs e-commerçants y participent. On trouve de très belles offres durant cette période. Donc, nous avons tout simplement décidé de vous partager les meilleures d'entre elles dans cet …"
N/A,"Soldes 2023 : la 3e démarque est lancée, retrouvez toutes les meilleures offres Tech ici",Frandroid,2023-07-20T08:17:52Z,"Les soldes d’été battent leur plein depuis maintenant 3 semaines. Rassurez-vous, il y a encore du temps pour faire de bonnes affaires et nous vous partageons uniquement les meilleures promotions et bons plans dans cet article actualisé très régulièrement."
N/A,Игровой планшет Red Magic получит экран с частотой 144 Гц и процессор Snapdragon 8+ Gen 1,Overclockers.ru,2023-07-03T08:17:30Z,Устройство показало высокий результат в бенчмарке AnTuTu
N/A,"Soldes 2023 : les meilleures pépites en promotion à ne pas manquer, avant que ce soit la fin",Frandroid,2023-07-25T08:22:52Z,"Les soldes d’été regorgent de promotions en tout genre, mais seul une poignée d’entre elles valent réellement coup. Voici donc, selon nous, les produits Tech à prix tellement bas qu'il serait vraiment bête de ne pas en profiter."
N/A,Soldes 2023 : découvrez les meilleures offres Tech encore disponibles avant la fin,Frandroid,2023-07-26T08:17:08Z,"La période des soldes d’été est très attendue pour faire de bonnes affaires sur des produits Tech. S’il ne reste plus qu’une semaine, la plupart des prix sont nettement plus intéressants que ceux affichés le reste de l’année."
N/A,Soldes 2023 : dernière démarque pour profiter des meilleures offres Tech,Frandroid,2023-07-27T08:33:09Z,"Voilà, nous sommes maintenant à la dernière ligne droite pour les offres des soldes d’été 2023. Rassurez-vous, il y a encore du temps pour faire de bonnes affaires et nous vous partageons uniquement les meilleures promotions et bons plans dans cet article act…"
N/A,CORSAIR 高性能遊戲配件增強遊戲體驗 全新 NIGHTSABRE 滑鼠、K65 PRO MINI 鍵盤,Hkepc.com,2023-07-20T08:56:42Z,CORSAIR 最新宣佈推出兩款高性能的 PC 遊戲配件，這兩款產品分別為 NIGHTSABRE WIRELESS 遊戲滑鼠和 K65 PRO MINI 光學機械遊戲鍵盤，即使是高強度的激烈戰事也不在話下。
N/A,"Corsair K65 Pro Mini RGB, análisis: este es el teclado mecánico compacto que llevábamos tiempo esperando",La Vanguardia,2023-07-16T04:02:30Z,"Uno de los elementos imprescindibles para cualquier redactor web es un buen teclado, ya que este es, con diferencia, el dispositivo que más usamos a lo largo de nuestra jornada laboral. Desde hace algún tiempo decidí desechar los teclados de membrana en favor…"
N/A,Официально: nubia Red Magic Gaming Tablet получит батарею на 10 000 мАч и зарядку на 80 Вт,Gagadget.com,2023-07-03T08:15:14Z,"Red Magic Gaming Tablet сможет похвастаться аккумулятором на 10 000 мАч. Согласно производителю, батарея будет поддерживать быструю зарядку с мощностью 80 Вт."
N/A,Three-Dimensional Ultrastructure of the Normal Rod Photoreceptor Synapse and Degenerative Changes Induced by Retinal Detachment,Jneurosci.org,2023-07-26T16:30:15Z,"The rod photoreceptor synapse is the first synapse of dim-light vision and one of the most complex in the mammalian CNS. The components of its unique structure, a presynaptic ribbon and a single synaptic invagination enclosing several postsynaptic processes, …"
N/A,“Maybe the Headset Isn’t the Way”,Libsyn.com,2023-07-08T16:04:00Z,Immersive technology is more than goggles. Jason Moser and Matt Frankel discuss:  - Apple’s bet on spatial computing - A major interface problem for headset adoption - Meta’s VR subscription service - Less obvious companies that could benefit from a boom in i…
N/A,Apple Maps offline offers more than Google Maps offline,Macdailynews.com,2023-07-14T13:38:06Z,"With its new offline maps, Apple has achieved more than parity with Google Maps on this important - if you don't have connectivity - feature…
The post Apple Maps offline offers more than Google Maps offline appeared first on MacDailyNews."
N/A,7월 5일 공개 '레드 매직' 게이밍 태블릿 80W 초고속 충전 10000mAh 배터리 탑재,Kbench.com,2023-07-02T23:47:58Z,"출처:웨이보
중국 통신 장비 업체 ZTE 스마트폰 브랜드 누비아에서 오는 5일 
공개할 예정인 '레드 매직' 게이밍 태블릿의 배터리 사양이 공개됐다.
지난 1일 누비아는 중국 SNS 웨이보를 통해 ""레드 매직 
게이밍 태블릿에 최대 80W 초고속 충전을 지원하는 10000mAh 배터리가 탑재될 것""이라고 
발표했다. 배터리는 55분이면 완충이 가능하다.
레드 매직 게이밍 태블릿은 지난 4월 공개된 ZTE Axon 패드의 
리브랜딩 모델로 알려졌다. ▲12.1인…"
N/A,ＢＳ日テレ火曜22時枠「あなたに魅せるドラマ池井戸潤スペシャル　連続ドラマW下町ロケット」が感動の最終回！,Prtimes.jp,2023-07-31T08:40:03Z,"[株式会社ＢＳ日本]
[画像1: https://prtimes.jp/i/125910/5/resize/d125910-5-a9acb019722d2a2b7de8-3.jpg ]

■BS日テレ火曜22時　「あなたに魅せるドラマ」枠　ラインナップ
＊7月4日～8月1日　池井戸潤スペシャル 連続ドラマW「下..."
N/A,12 Best Aerospace and Defense Stocks to Buy,Yahoo Entertainment,2023-07-06T15:54:36Z,"In this article, we will take a look at the 12 best aerospace and defense stocks to buy. To skip our analysis of the recent trends, and market activity, you ..."
N/A,Axon Public Safety Technology Roadshow Expands to Nine New Countries,Marketscreener.com,2023-07-06T11:31:06Z,"(marketscreener.com) 

Axon's fully customized trailer hits the road this summer— showcasing the latest public safety solutions across 30 cities
SCOTTSDALE, Ariz., July 6, 2023 /PRNewswire/ -- Axon , the global public safety technology leader, today announced…"
N/A,"커세어, 게임력 UP 고성능 마우스/키보드 2종 출시",Kbench.com,2023-07-17T01:41:17Z,"커세어(박재천 지사장)는 격렬한 플레이에서도 뛰어난 성능을 발휘하는 2종의 게이밍 기어, 나이트세이버 와이어리스 게이밍 마우스(NIGHTSABRE WIRELESS Gaming Mouse/이하 나이트세이버 무선 게이밍 마우스)와 K65 프로 미니 옵티컬 기계식 게이밍 키보드(K65 PRO MINI Optical-Mechanical Gaming Keyboard/ 이하 K65 프로 미니 광축 게이밍 키보드)를 출시한다고 밝혔다. 각각 뛰어난 반응속도와 성능을 제공하…"
N/A,"Oto mysz i klawiatura, które powinny zainteresować graczy",Benchmark.pl,2023-07-14T10:49:00Z,"Firma Corsair ogłosiła, że wprowadza na rynek dwa akcesoria do gier na PC: mysz gamingową Nightsabre Wireless i klawiaturę K65 Pro Mini."
N/A,A systematic CRISPR screen reveals redundant and specific roles for Dscam1 isoform diversity in neuronal wiring,Plos.org,2023-07-06T14:00:00Z,"The fruit fly Down syndrome cell adhesion molecule 1 (Dscam1) encodes 19,008 diverse ectodomain isoforms via alternative splicing. A systematic CRISPR screen of Drosophila Dscam1 reveals both redundant and specific functions of its isoforms in neuronal wiring."
N/A,Nowy tablet Redmagic spodoba się fanom długich sesji z grą,Tabletowo.pl,2023-07-04T08:33:44Z,"Lada chwila, obok smartfona Redmagic 8S Pro, pojawi się tablet przeznaczony dla mobilnych graczy. Co o nim wiemy?Przeczytaj pełny artykuł tutaj: Nowy tablet Redmagic spodoba się fanom długich sesji z grą"
N/A,"These Arizona companies are top in state, though Fortune 500 doesn't tell the whole story",AZCentral,2023-07-21T13:18:15Z,"Fortune's list focused on 2022 sales or revenue, but other measures like profitability and overall corporate value produce different results."
N/A,Two Insiders Scooped Up Taser-Maker Axon Stock in May and June,Biztoc.com,2023-07-07T03:06:04Z,"Two insiders have been buying shares of Axon Enterprises (US:AXON) in recent weeks, data compiled by Fintel shows. Moreover, many funds have been buying meaningful amounts of the company that makes Taser stun guns and body cameras used by police officers. But…"
N/A,ZTE Axon 40 Pro con fotocamera da 100 MP a 50€ in MENO,Html.it,2023-07-17T06:43:22Z,"Il mitico ZTE Axon 40 Pro, uno dei migliori smartphone Android, è in sconto di 50 euro su Amazon e ora è assolutamente da prendere.
Leggi ZTE Axon 40 Pro con fotocamera da 100 MP a 50€ in MENO"
N/A,La Soundbar per domarle tutte: è in OFFERTISSIMA la Trust Gaming GXT 620 Axon,Html.it,2023-07-13T17:30:45Z,"Soundbar Trust Gaming GXT 620 Axon: da oggi in offerta su Amazon a solamente 18,99€, con sconto pari al 46%!
Leggi La Soundbar per domarle tutte: è in OFFERTISSIMA la Trust Gaming GXT 620 Axon"
N/A,Huntingtin recruits KIF1A to transport synaptic vesicle precursors along the mouse axon to support synaptic transmission and motor skill learning,Elifesciences.org,2023-07-11T00:00:00Z,"Neurotransmitters are released at synapses by synaptic vesicles (SVs), which originate from SV precursors (SVPs) that have traveled along the axon. Because each synapse maintains a pool of SVs, only a small fraction of which are released, it has been thought …"
N/A,W&Wとの初コラボ曲「Gangster」をリリースしたばかりのイタリア人EDMデュオ、DJ／プロデューサーのVINAIが初登場！,Prtimes.jp,2023-07-31T03:00:00Z,"[株式会社TSTエンタテイメント]
[画像1: https://prtimes.jp/i/50845/15/resize/d50845-15-80cd1c92d3143a18363d-0.jpg ]

イタリア人EDMデュオ、DJ／プロデューサーのVINAIが初登場！

Alessandro Vinai とAndrea Vinaiの兄弟ユニットであるVIN..."
N/A,"Mitch McConnell, failed Supreme Court analyst, shouldn't quit his day job",MSNBC,2023-07-11T11:09:45Z,Mitch McConnell must think anyone reading his new opinion piece on the Supreme Court's just-concluded term is an idiot.
N/A,Axon promotes Brittany Bagley to COO role,Thefly.com,2023-07-05T21:06:01Z,"See the rest of the story here.

thefly.com provides the latest financial news as it breaks. Known as a leader in market intelligence, The Fly's real-time, streaming news feed keeps individual investors, professional money managers, active traders, and corpor…"
N/A,Red Magic Gaming Tablet Specs and AnTuTu Score Revealed,Gizchina.com,2023-07-03T07:05:41Z,"Nubia is all set to unveil its first-ever Red Magic gaming tablet. It will launch alongside the Red Magic 8S Pro. The launch event is ...
The post Red Magic Gaming Tablet Specs and AnTuTu Score Revealed appeared first on Gizchina.com."
N/A,Looking Back on the Supreme Court's 2022-23 Term,Reason,2023-07-01T21:31:14Z,Some end-of-term comments and an assessment of my end-of-term predictions.
N/A,Corsair launches new high-performance NIGHTSABRE WIRELESS mouse and K65 PRO MINI keyboard,TweakTown,2023-07-14T04:58:03Z,"Corsair has launched a pair of new peripherals for PC gamers, the NIGHTSABRE WIRELESS RGB Mouse and K65 PRO MINI RGB 65% Optical-Mechanical Keyboard. Continue reading at TweakTown >"
N/A,Saucony Kid’s Sneakers for only $19 shipped! (Reg. $50),Moneysavingmom.com,2023-07-11T20:50:33Z,Wow! Run over to Saucony to grab these HOT deals on shoes for kids! Saucony has a variety of Kid’s Shoes for only $19 shipped when you enter promo code SJK23UT at checkout! This is a perfect time to grab shoes for back to school! This is an amazing price on t…
N/A,Java-дайджест: начало июля,Habr.com,2023-07-03T04:22:01Z,"Привет. Это Олег из Фейловера. Я вылез из криокамеры и пытаюсь заставить себя писать регулярные дайджесты.В этом выпуске будет новый бесплатный (на самом деле нет) GraalVM Enterprise, отмена Java 8 в бигдате, совершенно новая система модулей (которую никто не…"
N/A,Nowości na Steam. Kandydat na RPG roku i obiecujący rywal Stardew Valley,Gry-online.pl,2023-07-31T05:54:43Z,"W tym tygodniu na Steamie zadebiutują takie gry, jak Cornucopia, F1 Manager 2023, Rise of the Triad: Ludicrous Edition, American Truck Simulator: Oklahoma, White Album oraz wersja 1.0 Baldur&apos;s Gate 3.
Informacja Nowości na Steam. Kandydat na RPG roku i …"
N/A,(PR) CORSAIR Launches High-Performance Peripherals to Boost Your Game,Techpowerup.com,2023-07-13T13:17:07Z,"CORSAIR, a world leader in high-performance gear for gamers and content creators, announced the launch of two showstopping PC gaming accessories that enhance even the most intense play: the NIGHTSABRE WIRELESS Gaming Mouse and K65 PRO MINI Optical-Mechanical …"
N/A,"This 2024 GOP hopeful has a new pitch: Raise money for me, keep 10%",Yahoo Entertainment,2023-07-10T13:00:02Z,"Republican presidential candidate Vivek Ramaswamy announced a new initiative Monday that gives his supporters a cut of the action if they prod their friends,..."
N/A,Új perifériapárost dobott piacra a Corsair,Prohardver.hu,2023-07-14T15:40:00Z,"Az amerikai székhelyű cég egy dönthető görgős, sokgombos wireless egeret és a hangelnyelő betétekkel megfejelt, kompakt billentyűzetet mutatott be."
N/A,Паттерн Saga в микросервисной архитектуре,Habr.com,2023-07-28T16:35:49Z,"Автор статьи: Артем Михайлов

Микросервисы — это популярный подход к построению систем, где приложение разбивается на отдельные компоненты, называемые микросервисами. Каждый микросервис занимается определенным функционалом и может работать независимо, что при…"
N/A,Guns per Capita by Country Vs Crime Rate: Top 20 Countries,Yahoo Entertainment,2023-07-06T15:57:07Z,"In this piece, we will take a look at guns per capita per country vs crime rate. If you want to skip our analysis of crime and gun statistics as well as the ..."
N/A,Policías municipales utilizarán paralizadores eléctricos contra delincuentes en Escobedo,Aristeguinoticias.com,2023-07-20T23:25:51Z,"La dependencia municipal aseguró que la policía está capacitada para manejar estas armas, y que fueron adiestrados en materia de derechos humanos."
N/A,Ta klawiatura mechaniczna od Corsair w takiej cenie to prawdziwa rzadkość!,Gry-online.pl,2023-07-19T17:00:00Z,"W RTV Euro AGD trwa wyprzedaż, na której znajdziecie szeroki wybór sprzętu i akcesoriów gamingowych marki Corsair. Myszki komputerowe, klawiatury, słuchawki – wszystko to w niesamowicie niskich cenach.
Informacja Ta klawiatura mechaniczna od Corsair w takiej…"
N/A,Mysterious Structures Appear to Play Unique Role in Sexual Pleasure,ScienceAlert,2023-07-04T02:50:28Z,"Once thought to sense a drop in temperature, curious nerve-filled capsules discovered in both male and female genitals in the 1850s could play a far more arousing role in mammalian physiology."
N/A,Motorola Approaches Buy Point As Analysts Boost Price Targets,Biztoc.com,2023-07-13T12:38:33Z,"S&P 500 component Motorola Solutions Inc. NYSE: MSI is within 1% of a buy point, getting a boost on July 12 along with the broader market. A look at the Motorola Solutions chart shows the stock forming a shallow consolidation that began on May 19, after notch…"
N/A,Will your favorite mobile game look better on the upcoming Nubia tablet?,PhoneArena,2023-07-03T13:16:12Z,"Mobile game graphics have gotten really good. Hence, a bigger screen is exactly what you need in order to appreciate them properly."
N/A,"RedMagic 8S Pro, análisis: aun más potencia por el mismo precio",La Vanguardia,2023-07-23T13:30:44Z,"Cuando a principios de 2023 pudimos analizar el RedMagic 8 Pro, lo elegimos como nuestro smartphone favorito para jugar de todos los que habíamos probado hasta la fecha. La combinación de especificaciones extremas, un diseño enfocado al juego y varias funcion…"
N/A,CORSAIR Launches NIGHTSABRE WIRELESS Gaming Mouse and K65 PRO MINI Keyboard,guru3d.com,2023-07-13T14:01:39Z,CORSAIR announced the launch of two exceptional PC gaming accessories designed to elevate gaming to new heights: the NIGHTSABRE WIRELESS Gaming Mouse and the K65 PRO MINI Optical-Mechanical Gaming Key...
N/A,6 Bodily tissues that can be regenerated through nutrition,Naturalnews.com,2023-07-28T06:00:00Z,"It may come as a surprise to some, especially those with conventional medical training, but the default state of the body is one of ceaseless regeneration. Without the flame-like process of continual cell turnover within the body – life and death ceaselessly …"
N/A,NIGHTSABRE WIRELESS y K65 PRO MINI: periféricos de ‘alto rendimiento’ de CORSAIR,Elchapuzasinformatico.com,2023-07-14T08:07:01Z,"CORSAIR anunció el lanzamiento de dos nuevos periféricos catalogado de ""alto rendimiento"", estos son el ratón NIGHTSABRE WIRELESS y el teclado K65 PRO MINI. Ambos dispositivos periféricos comparten un sistema de iluminación LED RGB personalizable por medio de…"
N/A,"Tesla downgraded, Netflix upgraded: Wall Street's top analyst calls",Yahoo Entertainment,2023-07-24T13:53:02Z,"Tesla downgraded, Netflix upgraded: Wall Street's top analyst calls"
N/A,Souris NIGHTSABRE WIRELESS et clavier K65 PRO MINI pour CORSAIR,Cowcotland.com,2023-07-17T06:26:52Z,"CORSAIR a annoncé le lancement de deux accessoires gaming pour PC qui améliorent même les sessions les plus intenses : la souris gaming NIGHTSABRE WIRELESS et le clavier gaming mécanique-optique K65 PRO MINI.

Chacun de ces accessoires propose une réactivité …"
N/A,Molecular basis of interactions between CaMKII and a-actinin-2 that underlie dendritic spine enlargement,Elifesciences.org,2023-07-25T00:00:00Z,"Ca2+/calmodulin-dependent protein kinase II (CaMKII) is essential for long-term potentiation (LTP) of excitatory synapses that is linked to learning and memory. In this study, we focused on understanding how interactions between CaMKIIα and the actin crosslin…"
