Stock,Title,Source,Published At,Description
N/A,Arresteringsorder utfärdad mot 20 för stormning,Aftonbladet.se,2023-07-20T17:34:30Z,En tingsrätt i Iraks huvudstad Bagdad har utfärdat en arresteringsorder för 20 personer för stormningen av Sveriges amba
N/A,Två män avrättade i Iran efter Shirazdåd,Aftonbladet.se,2023-07-08T07:59:22Z,Två män har avrättats genom hängning efter att ha dömts för en attack vid en av shiamuslismernas heligaste platser i sta
N/A,Lehet 2 hengerrel kevesebb? 421 lóerővel támad a gyengébbik új Mercedes-AMG GLC,Hvg.hu,2023-07-18T05:59:00Z,A V6-os egységet lágyhibrid 4 hengeres hajtáslánc váltotta az AMG GLC 43-ban.
N/A,57 muslimska stater kräver skydd för koranen,Expressen.se,2023-07-02T12:27:03Z,"57 muslimska stater kräver nu åtgärder för att skydda koranen, rapporterar Reuters. Detta bara dagar efter att en man tänt eld på en koran utanför en moské i Stockholm."
N/A,Varningen till svenskarna i semesterparadiset,Expressen.se,2023-07-22T11:55:58Z,Stora skogsbränder fortsätter att härja på Rhodos. Svenskarna Jessica Steninger och Matilda Nordström befinner sig en bit utanför byn Lardos där man under dagen påbörjat evakuering. – Det luktar eld och rök.
N/A,"Figyelmeztetést kapott a Corvinustól Ádám Zoltán, aki etikai vizsgálatot kezdeményezett az egyik diákkal kivételező oktatókkal szemben",Hvg.hu,2023-07-03T16:05:00Z,"Az egyetem azt kifogásolta, hogy Ádám Zoltán véleménye nyilvánosságra került."
N/A,Islamfientlig grupp brände bok i Köpenhamn,Svenska Dagbladet,2023-07-24T12:19:04Z,"En islamfientlig grupp uppger under måndagen att de tände eld på en koran utanför Iraks ambassad i Danmark, skriver nyhetsbyrån Ritzau. En livsändning på gruppens Facebooksida visade när boken brann. Ritzau rapporterar även att personerna rev sidor ur boken o…"
N/A,90 livstidsdomar för Walmartskytten i El Paso,Aftonbladet.se,2023-07-07T18:41:45Z,▸ Mannen som sköt ihjäl 23 personer i en rasistisk attack mot latinamerikaner i ett Walmartvaruhus i Texas i augusti 2019…
N/A,Nya protester vid Gröna zonen i Bagdad,Aftonbladet.se,2023-07-22T18:22:12Z,Nya försök att storma Gröna zonen i Iraks huvudstad Bagdad genomfördes på lördagen i pågående protester mot Danmark efte
N/A,Amnesti i Serbien gav 108 000 vapen,Aftonbladet.se,2023-07-01T20:14:30Z,"I maj utlystes vapenamnesti i Serbien, sedan landet skakats av två masskjutningar på kort tid. Polisen har nu meddelat r"
N/A,Källa: Svenska ambassaden i Irak stormad,Svenska Dagbladet,2023-07-20T00:07:12Z,"Flera hundra personer ska ha stormat den svenska ambassaden i Iraks huvudstad Bagdad och satt eld på den, uppger en källa och ett ögonvittne för Reuters. TT har varit i kontakt med UD:s presstjänst, som varken vill bekräfta eller dementera uppgifterna."
N/A,Ny ansökan om koranbränning,Svenska Dagbladet,2023-07-24T14:26:03Z,"En ny ansökan om att bränna koranen har kommit in till polisen, rapporterar SVT Nyheter. Ansökan gäller för en plats utanför Irans ambassad i Stockholm på lördag, och har lämnats in av en 31-årig man. Mannen vill utöver koranen tända eld på en bild av Irans l…"
N/A,Franskt nationaldagsfirande i skuggan av upplopp,Svenska Dagbladet,2023-07-14T03:31:02Z,"Fyrverkeriförbud, massiv polisbevakning och ett inställt presidenttal. När fransmännen i dag firar nationaldag är det i ett land som än en gång skakats av våldsamma upplopp. – Var eller när den gnista som kan tända en ny eld dyker upp är omöjligt att veta, sä…"
N/A,Två män avrättade i Iran efter Shirazdåd,Svenska Dagbladet,2023-07-08T07:59:23Z,Två män har avrättats genom hängning efter att ha dömts för en attack vid en av shiamuslismernas heligaste platser i staden Shiraz i södra Iran. Det var i oktober som en gärningsman öppnade eld mot Shah Cheragh-mausoleet under kvällsbönen. 13 människor dödade…
N/A,Brand på fartyg med 3 000 bilar – minst en död,Svenska Dagbladet,2023-07-26T05:05:47Z,"Ett fraktfartyg har fattat eld utanför Nederländernas kust. Minst en person är död och flera har skadats i branden, rapporterar AFP. 23 sjömän har tvingats lämna fartyget. En del av dem ska ha hoppat överbord och plockats upp av fartyg som kommit till undsätt…"
N/A,Ny koranbränning – utanför riksdagen,Expressen.se,2023-07-31T12:25:57Z,Koranen har brunnit i Stockholm igen. Salwan Najem och Salwan Momika stod bakom aktionen – ett stenkast från Sveriges riksdag.
N/A,Explosion och brand i Kristandstad – spridit sig till lägenhet,Expressen.se,2023-07-20T01:43:21Z,"En explosion har inträffat i en frisörsalong i centrala Kristianstad. Byggnaden fattade eld och branden har spridit sig till ovanliggande lägenheten. – Min bild är att det inte är någon som är allvarligt skadad, säger Johan Wendt, vakthavande befäl på räddnin…"
N/A,Buropen: ”Koranen finns i mitt hjärta”,Svenska Dagbladet,2023-07-20T14:36:02Z,Ett tiotal åskådare hade samlats utanför den irakiska ambassaden i Stockholm för att protestera mot den planerade koranbränningen. Men aktionen avslutades utan att någon koran brändes.
N/A,Expert: Koranbränning kan strida mot lagen,Svenska Dagbladet,2023-07-04T03:30:24Z,Frågan om koranbränning kan vara hets mot folkgrupp har aldrig prövats i svensk domstol – men enligt juridikprofessor Vilhelm Persson kan förra veckans koranbränning ha varit brottslig. – Jag tycker inte att det är självklart att yttrandefriheten sträcker sig…
N/A,Billström: De som vill så split får inte lyckas,Svenska Dagbladet,2023-07-31T13:25:48Z,Nya åtgärder övervägs när 57 muslimska länder möts – samma dag som en ny koranbränning i Sverige. I ett brev inför mötet skriver utrikesminister Tobias Billström att de som vill splittra samhället ”inte får tillåtas att lyckas”.
N/A,勞動部推中高齡者就業促進計畫 (圖),Yahoo Entertainment,2023-07-05T00:14:53Z,勞動部5月啟動「中高齡者及高齡者就業促進計畫」，中彰投區銀髮人才資源中心表示，銀髮中心除提供諮詢，從求職前的準備到就業後的適應與陪伴，及時提供就業、職訓等相關資訊外，更搭配各類職涯講座助銀髮者建立自我信心。
N/A,屏東林管處設柵欄　遏阻沙灘車進入國有林地,Yahoo Entertainment,2023-07-18T20:59:00Z,墾丁國家公園境內、國有林、保安林等區域禁止騎乘沙灘車，但過去卻常發生有業者違法飆沙，破壞生態，現在林管處聯合警方祭出殺手鐧，在屏東滿州鄉港仔村、九棚村設置紐澤西護欄，並用鐵鍊拴緊，阻絕沙灘車進入。遊客...
N/A,竹市推黑蝙蝠中隊文物陳列館教具箱（1） (圖),Yahoo Entertainment,2023-07-05T01:38:00Z,為使學童更加了解地方文史，新竹市政府推出「暗夜英雄－黑蝙蝠中隊文物陳列館教具箱」，內含紙質文物、縮小版模型等，讓行動博物館走進校園。
N/A,自稱「盧太太」控遭盧廣仲不禮貌求償29萬　又噴漆經紀公司！下場出爐,Yahoo Entertainment,2023-07-05T01:05:02Z,記者楊佩琪／台北報導 一名對外自稱「盧廣仲的太太」30多歲吳姓女子，日前提告盧廣仲對她有「不禮貌行為」，且長期以遠端操控方式，偷看她的手機，竊取創作靈感，造成她精神損
N/A,最新影片曝光！疑涉土地重劃案　台南前議長郭信良遭搜索,Yahoo Entertainment,2023-07-05T20:20:06Z,社會中心／洪正達報導 疑似因土地重劃等相關案件，台南市前議長、現任議員郭信良服務處、議會辦公室及相關人員處所等地點突然在7日早上遭到檢調多路搜索，同時查扣多筆證物帶回
N/A,民眾提款機領不到錢　員警一招解決,Yahoo Entertainment,2023-07-19T02:04:00Z,[NOWnews今日新聞]高雄市1名吳姓男子（80歲）至銀行ATM欲提領新臺幣6萬元，操作完後不知為何機器並未吐鈔，卻又看到交易明細表上竟有顯示提領金額6萬元，吳男見狀恐被銀行扣款，擔心新臺幣6萬元憑...
N/A,太囂張！外送員被委託「到立委服務處開槍」　警方加強戒備,Yahoo Entertainment,2023-07-23T18:52:42Z,有夠囂張！近期網路流傳一張外送平台的外送單截圖，內容就是徵求「槍手」持把槍到立委林淑芬位於新北市蘆洲的服務處開槍恐嚇。對此，蘆洲分局不敢大意，立即組成專案小組追查該相關單位的通聯記錄，並加強服務處巡邏密度，全案將依恐嚇罪偵辦中。
N/A,雲林登革熱延燒 桐花公園及周邊步道無限期封閉 (圖),Yahoo Entertainment,2023-07-21T21:28:06Z,雲林登革熱從7月1日至21日累計68例，雲林縣政府考量古坑鄉為疫情熱區，宣布即日起古坑鄉的病報病例，快篩陽即判定為確診病例；另荷苞山桐花公園及周邊步道無限期封閉。
N/A,3男扮大盜　竟竊走台電5噸電纜線獲利百萬,Yahoo Entertainment,2023-07-19T00:17:24Z,雲林縣張姓、鄭姓、林姓3名男子共謀，利用油壓剪等器具在雲林、南投、台南共謀竊取台電電纜線，再賣給2名資源回收商，總計6個月內共行竊15次、竊取5公噸的電纜線，不法所達高達百萬，雲林地檢署調查後認為3名竊取電纜線被告，涉犯《刑法》加重竊盜罪，2名回收商涉犯故買贓物罪，5人依法提起公訴。
N/A,士檢首件犯罪被害人保護命令 防數位性別暴力,Yahoo Entertainment,2023-07-15T21:56:17Z,（中央社記者林長順台北16日電）一名被告疑以性影像恐嚇被害人，士林地檢署日前展開搜索、約談，並核發犯罪被害人保護命令，這是犯罪被害人權益保障法新法施行後，士檢第一件犯罪被害人保護命令。
N/A,旅客回流 屏東海生館夜宿人數增5成,Yahoo Entertainment,2023-07-13T12:10:00Z,隨著疫情解封、暑假來臨，今年屏東海生館的夜宿遊客數比去年增加5成，外國客也逐漸回流，館方為創造更大的吸引力，近日推出全新活動「歡迎光臨我的海生館」，公開10組館內員工及旅人的獨特視角，帶大家一窺私藏角落。
N/A,離譜！高雄女滿嘴「毒氣」　開口就毒氣薰天害警方凍未條,Yahoo Entertainment,2023-07-13T21:26:07Z,鳳山分局表示，薛女日前騎車時在路上不斷蛇行，駕車行為十分危險，員警好心上前勸阻盤查，不料薛女不但神情恍惚，一開口講話就三發出濃濃毒品味，讓警方直搖頭，忍不住直接詢問「你有違禁品嗎？」。薛女不但沒承認還理直氣壯向警方供稱剛生產完已經沒在用，員警仍堅決搜查，...
N/A,台北夏季旅展登場 新北館超殺最低2折起,Yahoo Entertainment,2023-07-14T00:35:26Z,（中央社記者黃旭昇新北14日電）台北國際夏季旅展今天登場，新北觀旅局攜手多家觀光工廠業者參展，推出多項超低優惠搶客，推薦民眾放慢腳步，漫遊探索新北豐富山海美景。旅展現場也有多項DIY體驗活動。
N/A,快告訴我是假的！李玟去世登微博熱搜第一,Yahoo Entertainment,2023-07-05T23:16:59Z,記者陸懷恩／台北報導 知名藝人李玟（CoCo）5日晚驚傳輕生離世，姐姐李思林在當日先後在臉書、微博發布噩耗。李 […]
N/A,老翁入山巡水源失聯！家人急報警　警消驚見他倒臥山坡亡,Yahoo Entertainment,2023-07-20T02:05:03Z,初步了解，72歲的黃姓老翁上午8時上山巡視水源，以確保灌溉路線無損壞或阻塞情形，不料卻遲遲未返家，家人苦等不到老翁人影，打電話尋人也未有結果，驚覺有異，緊急報警。警消獲報後於10時許發現倒在竹林山坡內的黃姓老翁，眾人合力將老翁抬起，但警消人員與老翁接觸時，其已...
N/A,聊天聊到翻臉！4嫌犯為50萬債務毆打擄人,Yahoo Entertainment,2023-07-19T20:10:39Z,民視新聞／陳怡汝、洪國凱、陳奎宏 台北市報導台北市南港區，今天（20日）凌晨12點半，一群人對著一名男子不斷毆打，之後還將他強行帶上車，警方獲報，調閱監視器發動攔截圍捕，帶回動手的4名嫌犯，原來雙方因為50萬元債務糾紛，一言不合，才會爆發肢體衝突，訊後通通被依照聚眾鬥毆、妨害自由等罪，移送偵辦。
N/A,台南「麻省理工」棋牌社麻將聚賭 警逮33人送辦,Yahoo Entertainment,2023-07-20T22:43:40Z,（中央社記者張榮祥台南21日電）台南市北區一家名為「麻省理工」棋牌社，招攬會員後再以儲值收費方式聚眾打麻將。警方今天凌晨突檢查緝，逮捕負責人及賭客共33人，查扣賭資、籌碼等物，訊後依法送辦。
N/A,冷氣申請裝在內凹花台卻墜落砸死人　工務局認：管委會有同意,Yahoo Entertainment,2023-07-20T20:35:42Z,新北市政府表示，勞檢處第一時間隨即派員前往實施檢查。調查發現，施工單位在安裝過程中，疑似未保持冷氣機的牢穩，造成冷氣機飛落釀成不幸。勞檢處當場即勒令停工，涉及違反《職安法》相關規定將依法處罰，最高可處30萬元罰鍰。市府強調，除勞檢處外，工務局也出動調查，根...
N/A,歐洲復興開發銀行參訪台南智慧交通 分享成果經驗,Yahoo Entertainment,2023-07-25T22:43:33Z,（中央社記者張榮祥台南26日電）歐洲復興開發銀行一行15人今天參訪台南市智慧化交通、停車管理及綠能運具等數位軟硬體建設，雙方分享相關業務成果與經驗。
N/A,為數百元爭吵 7旬翁追殺妻,Yahoo Entertainment,2023-07-27T05:49:00Z,本報記者綜合報導 新北市淡水區七十八歲何姓男子疑因新台幣數百元與七十三歲太太發生衝突，他一氣之下持剪刀刺向太太 […]
N/A,通緝犯酒後大吼大叫　引警到場逮捕,Yahoo Entertainment,2023-07-31T04:10:28Z,［ 記者 宋祥霖／高雄 報導 ］ 男子飲酒後在路上大吼大叫，鳳山分局員警仔細查證發現原來男子是名通緝犯，將他逮
N/A,三星鄉長李志鏞涉貪遭起訴 檢建請從重量刑,Yahoo Entertainment,2023-07-13T03:44:37Z,（中央社記者王朝鈺宜蘭13日電）宜蘭縣三星鄉長李志鏞涉嫌將2件標案內定給張姓男子負責的公司得標，事後共收40萬元賄款，檢方今天偵查終結，起訴李志鏞等共5人，認李志鏞惡性重大，建請法院從重量刑。
N/A,避免驚擾育雛 南投林管處設置隔離線 (圖),Yahoo Entertainment,2023-07-05T23:03:53Z,南投林區管理處今年度調查，湖本村有3對八色鳥，林中村則有2對八色鳥築巢繁殖，為避免驚擾育雛過程，南投林管處與雲林縣政府緊急設置隔離線及告示牌等，提醒民眾注意。
N/A,燒作品復仇！女兒遭藝術家性侵　母曾發文痛罵攝影界禽畜,Yahoo Entertainment,2023-07-05T23:15:09Z,生活中心／綜合報導近日1名梁姓藝術工作者發文指控，20多年前謝姓藝術家認她做乾女兒，卻對她性侵並強拍裸照，當年她僅有13歲；今天梁女母親也轉發女兒貼文，並痛罵：「你該出來受死了！畜
N/A,5連霸議員遭查出賄選　當選無效！一審再判2年、罰金60萬,Yahoo Entertainment,2023-07-13T21:13:00Z,【記者鮮明／彰化報導】彰化縣議員林茂明被控在去年地方選舉期間，透過助理等人以每票500元，向39位選民交付賄賂。林茂明坦承買票，被彰化地檢署依違反選罷法起訴，並提起民事當選無效之訴；彰化地院今年4月一審判林茂明民事當選無效成立，刑事部分今天（14日）再判他2年徒刑、併科罰金60萬元。可上訴。
N/A,十萬紅包躺路上！怕冥婚不敢撿　妙齡女善心救了酒醉婦,Yahoo Entertainment,2023-07-15T18:02:50Z,日前在台中市東區發生一起紅包遺失案件，路上突然出現了一個鼓鼓的紅包袋，不少民眾深怕是「冥婚」，而不敢接近，43歲的劉姓女子經過後，發現裡面竟然裝著10萬元現金，她心裡雖有浮現冥婚的念頭，但是他更相信這筆錢是重要用途，於是她把錢送到派出所，最後失主是一名70歲的黃姓婦人，錢是用來發給粗工的薪水，所幸被善心民眾撿回，黃婦相當感激。
N/A,假交易詐貸56億！鼎興負責人何宗英3度起訴　再判6年10月,Yahoo Entertainment,2023-07-05T01:23:43Z,鼎興公司是國內知名的牙科器材廠商，成立於1949年，1951年起自日本、歐美進口牙材，負責人何宗英是中山醫學院牙科畢業、日本大學齒學博士，曾任台北市牙醫師公會理事長，在牙醫界頗具知名度，不過鼎興貿易因資金周轉問題，從2008年起開始製作假的醫院牙科部與診所醫師合約，...
N/A,石灰岩路面遭沖蝕 高雄半屏山後巷登山口封閉施工,Yahoo Entertainment,2023-07-05T01:33:08Z,（中央社記者蔡孟妤高雄5日電）高雄半屏湖至半屏山中央瞭望台間登山路徑因石灰岩路面嚴重沖蝕，林務局與國家自然公園管理處今天起進行相關改善工程，預計明年1月下旬完工，施工期間遊客可改由翠華路登山口入山。
N/A,智能手錶爆炸！　童手腕冒火球燒傷恐植皮,Yahoo Entertainment,2023-07-04T04:01:04Z,新北市土城一名10歲男童，走去補習班的路上，戴了4年的智能手錶，突然爆炸起火，手腕瞬間冒出火球，相當驚悚！他痛的放聲大哭尖叫，隔壁彩券行老闆聽到後，立刻幫忙擦藥並連絡家長，皮膚傷勢二度灼傷，恐怕得做植皮手術。
N/A,調查局高階人事異動　博達案英雄接任新北市處秘書長,Yahoo Entertainment,2023-07-04T03:43:06Z,CNEWS匯流新聞網記者張孝義／台北報導 法務部調查局今（4）日公布6名簡任高階主管人事異動，曾偵辦首件跨國假帳「博達案」的督察處金門縣駐區督察胡國華，接任新北市調處秘書長，此外，被稱為「緝毒達人」的經濟犯罪防制處副處長蔡健崇調任航業調查處副處長，異動人事將於17日到職。 發生在93年的博達案，是國內首件的跨國假帳案，由於博達財務部門將帳目近乎完美切割，且事...
N/A,高雄冰店沙門氏桿菌44人中毒　「腎衰竭」小弟傳好消息！已轉普通病房,Yahoo Entertainment,2023-07-18T21:05:07Z,記者洪正達／高雄報導 高雄六合路欣豐冰店爆出食安，有多名消費者12日食用過店內冰品後陸續出現不適情形，大部分因感染沙門氏桿菌出現拉肚子等情形，據衛生局掌握的患者數量已
N/A,機車闖宜蘭河濱滑板U池　塑鋼板破損玩家心疼,Yahoo Entertainment,2023-07-18T21:03:00Z,宜蘭縣河濱公園有滑板練習場，但最近卻來了不速之客。有人直接把摩托車，騎上滑板U池，上下擺盪，不但危險，更讓附近的滑板玩家相當氣憤。設施內的塑鋼板，都被破壞，邊緣翹起，嚴重影響其他玩家在這練習的安全。宜...
N/A,安裝有技巧！直立窗型冷氣關鍵「6處螺絲點」,Yahoo Entertainment,2023-07-20T21:23:01Z,持續追蹤這起意外！儘管安裝冷氣符合管委會規定，不過工人坦承過程中螺絲沒鎖緊，有其他同行業者透露，直立式窗型冷氣，儘管裝設簡單，但關鍵就是六處螺絲點，一定是兩顆螺絲太鬆才會掉落！事隔一天，有民眾到案發現場獻花哀悼，至於通勤族幾乎都在騎樓下等公車，不敢再站在人行道。
N/A,住戶控保全騷擾2次報警無效　她「潑紅茶」反挨罰1萬,Yahoo Entertainment,2023-07-19T19:55:36Z,新北一名女性住戶表示，自己受到大樓保全長期騷擾，保全還用管理室電話打給她，說出「我害怕到射出來了」等言語，女住戶氣得報警2次，都沒有得到警方妥善處理。去年6月女住戶和保全談和，卻因為被保全嚇到，不慎將手中紅茶潑向保全，保全憤而提告。法院審理時發現，女住戶的供詞和證據不符，依強暴侮辱罪判處女住戶拘役10天，可易科罰金1萬元。
N/A,藏身高級商辦！　「博弈遊戲系統商」遭破獲,Yahoo Entertainment,2023-07-20T03:36:09Z,掛著「遊戲設計公司」，卻替替博弈網站做遊戲、維護系統、風險管理等工作，還藏身在台中七期高級商辦。地檢署和警方組成專案小組跟監蒐證，破獲犯罪集團，查獲41人到案。成員有九成都是畢業新鮮人，集團以遊戲設計公司的名義、開高薪、優渥福利，在人力銀行上應徵。
N/A,淡水漁人碼頭中午傳溺水！44歲女落水　被海巡人員救起,Yahoo Entertainment,2023-07-19T21:25:07Z,記者游承霖／新北報導 新北市淡水漁人碼頭，今天（20日）中午傳出落水意外，一名陳姓女子與友人在漁人碼頭散心，走到海巡隊部對面的碼頭時，卻墜落港內，新北市消防局、海巡人
N/A,天降冷氣砸死政大女高材生　當地里長怒批：實在很可惡！,Yahoo Entertainment,2023-07-20T02:10:10Z,記者游承霖／新北報導 新北市一名黃姓政大女高材生，今天（20日）下午在板橋新埔捷運站2號出口等公車時，30公斤重的窗型冷氣從17樓高空墜落當場砸中黃女，造成黃女重創宣
N/A,大膽！他闖警局割爆56警用機車坐墊　又砸毀公園鏡子遭逮,Yahoo Entertainment,2023-07-26T01:42:26Z,新北市海山警分局自從2月及4月，陸續發現停放於駐地旁的56輛警用機車坐墊，遭人故意毀損，3月時，板橋區民生公園內廁所鏡子，也遭人丟擲石頭致毀損，另外4月時超商店內物品也遭人竊取，計損失新臺幣1172元。經警方擴大調閱監視器影像後，發現都是同一人所為，訊後依妨害公務、竊盜及毀損罪嫌移請新北檢偵辦。
N/A,女子捷運地下街行竊 得手價值8千美經典品牌包,Yahoo Entertainment,2023-07-23T20:22:50Z,民視新聞／陳怡汝、洪國凱 台北市報導台北市京站百貨公司，捷運地下街1樓，1間美國知名品牌皮件包包，遭到宵小光顧！嫌犯是1名短髮中年婦女，她疑似早就鎖定一款價值約8000元包包，趁店員不注意下手，犯案時間不到5秒鐘，隨即逃逸；店員事後清點才發現「包包不見了」，警方目前正在追查中。
N/A,砂石車超載滲漏違規多 三峽警1個月內罰逾200萬,Yahoo Entertainment,2023-07-26T22:21:30Z,（中央社記者高華謙新北27日電）新北三峽警分局統計，今年7月起已舉發237件大型車輛違規，其中較嚴重違規如砂石車超載14件，載運貨物車輛不依規定15件、飛散滲漏3件，32張罰單總金額超過新台幣200萬元。
N/A,Macron orubblig när Erdogan protesterade,Svenska Dagbladet,2023-07-04T19:53:17Z,KOMMENTAR. Långt före koranbränningarna i Sverige kritiserade delar av den muslimska världen Frankrike för hädelse och skändningar av deras religiösa symboler. Det är tillåtet att häda i Frankrike sedan över 200 år – en rätt som ofta utnyttjas.
N/A,向檢察官求償敗訴 彭文正未繳裁判費上訴遭駁回,Yahoo Entertainment,2023-07-03T19:06:09Z,（中央社記者劉世怡台北4日電）前電視節目主持人彭文正涉誹謗總統蔡英文遭起訴，但他認為檢察官在起訴書中抹黑他，求償200萬元。彭文正求償一審敗訴後上訴，但未繳裁判費，北院日前裁定上訴駁回。可抗告。
N/A,布袋好美里固沙養灘25公頃 翁章梁：打造沿海新景點,Yahoo Entertainment,2023-07-16T22:45:40Z,（中央社記者黃國芳嘉義縣17日電）嘉義縣布袋鎮好美里長期推動沙灘復育，自104年起固沙養灘，將沙灘面積拓增25公頃，縣長翁章梁今天前往視察，承諾後續將召開協調會，將好美沙灘打造成沿海新景點。
N/A,澎湖縣廟宇文物特展登場（2） (圖),Yahoo Entertainment,2023-07-15T21:53:50Z,「神器神氣：澎湖縣廟宇文物特展」16日起在澎湖生活博物館登場，展出講美龍德宮的石香爐。
N/A,Sony’s latest PS5 beta supports Dolby Atmos and up to 8TB of M.2 SSD storage,The Verge,2023-07-31T09:44:42Z,Sony’s latest PS5 beta update includes some great quality of life improvements. Dolby Atmos support and up to 8TB of M.2 SSD storage are the big additions.
N/A,The Best Prime Day Deals on Laptops,Lifehacker.com,2023-07-11T22:15:00Z,"Amazon’s Prime Day sale is upon us, and there are quite a lot of laptop bargains to go around, from everyday college laptops, to MacBooks, and even high-end gaming machines. If you are in the market for a laptop, or were planning to buy one soon, this is a gr…"
N/A,"New PS5 beta adds support for Dolby Atmos, 8TB SSD storage and more",Engadget,2023-07-31T11:35:12Z,"Your PS5 might have some fresh features coming its way, with Sony announcing a new PS5 software beta update with Dolby Atmos support, more accessibility components, and greater M.2 SSD storage. The addition of Dolby Atmos support should let you play the PS5's…"
N/A,Framework Laptop 13 Review (2023): The Repairable Laptop Gets Even Better,Wired,2023-07-06T14:00:00Z,This upgradable PC is one of the best you can buy.
N/A,Get This Refurbished Lenovo Desktop Computer for 42% Off,Lifehacker.com,2023-07-14T16:15:00Z,"Shopping for a computer on a budget is a tall order. But if you need a computer just to run productivity software or access the internet, don’t pay for one that’s also equipped to render modern games on the highest graphical settings. A refurbished computer w…"
